"No.","Time","Source","Destination","Protocol","Length","Info"
"1","0.000000000","127.0.0.1","127.0.0.1","TCP","229","38492  >  5001 [PSH, ACK] Seq=1 Ack=1 Win=6146 Len=163 TSval=703394168 TSecr=703394140"
"2","0.000118078","127.0.0.1","127.0.0.1","TCP","450","5001  >  38492 [PSH, ACK] Seq=1 Ack=164 Win=3083 Len=384 TSval=703394168 TSecr=703394168"
"3","0.000172513","127.0.0.1","127.0.0.1","TCP","229","38492  >  5001 [PSH, ACK] Seq=164 Ack=385 Win=6146 Len=163 TSval=703394168 TSecr=703394168"
"4","0.000208384","127.0.0.1","127.0.0.1","TCP","450","5001  >  38492 [PSH, ACK] Seq=385 Ack=327 Win=3083 Len=384 TSval=703394168 TSecr=703394168"
"5","0.000259631","127.0.0.1","127.0.0.1","TCP","229","38492  >  5001 [PSH, ACK] Seq=327 Ack=769 Win=6146 Len=163 TSval=703394168 TSecr=703394168"
"6","0.000290884","127.0.0.1","127.0.0.1","TCP","450","5001  >  38492 [PSH, ACK] Seq=769 Ack=490 Win=3083 Len=384 TSval=703394168 TSecr=703394168"
"7","0.000315436","127.0.0.1","127.0.0.1","TCP","229","38492  >  5001 [PSH, ACK] Seq=490 Ack=1153 Win=6146 Len=163 TSval=703394169 TSecr=703394168"
"8","0.000341256","127.0.0.1","127.0.0.1","TCP","450","5001  >  38492 [PSH, ACK] Seq=1153 Ack=653 Win=3083 Len=384 TSval=703394169 TSecr=703394169"
"9","0.000366286","127.0.0.1","127.0.0.1","TCP","229","38492  >  5001 [PSH, ACK] Seq=653 Ack=1537 Win=6146 Len=163 TSval=703394169 TSecr=703394169"
"10","0.000394172","127.0.0.1","127.0.0.1","TCP","450","5001  >  38492 [PSH, ACK] Seq=1537 Ack=816 Win=3083 Len=384 TSval=703394169 TSecr=703394169"
"11","0.000418230","127.0.0.1","127.0.0.1","TCP","229","38492  >  5001 [PSH, ACK] Seq=816 Ack=1921 Win=6146 Len=163 TSval=703394169 TSecr=703394169"
"12","0.000446999","127.0.0.1","127.0.0.1","TCP","450","5001  >  38492 [PSH, ACK] Seq=1921 Ack=979 Win=3083 Len=384 TSval=703394169 TSecr=703394169"
"13","0.000477453","127.0.0.1","127.0.0.1","TCP","229","38492  >  5001 [PSH, ACK] Seq=979 Ack=2305 Win=6146 Len=163 TSval=703394169 TSecr=703394169"
"14","0.000507523","127.0.0.1","127.0.0.1","TCP","450","5001  >  38492 [PSH, ACK] Seq=2305 Ack=1142 Win=3083 Len=384 TSval=703394169 TSecr=703394169"
"15","0.000539145","127.0.0.1","127.0.0.1","TCP","229","38492  >  5001 [PSH, ACK] Seq=1142 Ack=2689 Win=6146 Len=163 TSval=703394169 TSecr=703394169"
"16","0.000567689","127.0.0.1","127.0.0.1","TCP","450","5001  >  38492 [PSH, ACK] Seq=2689 Ack=1305 Win=3083 Len=384 TSval=703394169 TSecr=703394169"
"17","0.000594216","127.0.0.1","127.0.0.1","TCP","229","38492  >  5001 [PSH, ACK] Seq=1305 Ack=3073 Win=6146 Len=163 TSval=703394169 TSecr=703394169"
"18","0.000621034","127.0.0.1","127.0.0.1","TCP","450","5001  >  38492 [PSH, ACK] Seq=3073 Ack=1468 Win=3083 Len=384 TSval=703394169 TSecr=703394169"
"19","0.000648622","127.0.0.1","127.0.0.1","TCP","229","38492  >  5001 [PSH, ACK] Seq=1468 Ack=3457 Win=6146 Len=163 TSval=703394169 TSecr=703394169"
"20","0.000674038","127.0.0.1","127.0.0.1","TCP","450","5001  >  38492 [PSH, ACK] Seq=3457 Ack=1631 Win=3083 Len=384 TSval=703394169 TSecr=703394169"
"21","0.000699285","127.0.0.1","127.0.0.1","TCP","229","38492  >  5001 [PSH, ACK] Seq=1631 Ack=3841 Win=6146 Len=163 TSval=703394169 TSecr=703394169"
"22","0.000724911","127.0.0.1","127.0.0.1","TCP","450","5001  >  38492 [PSH, ACK] Seq=3841 Ack=1794 Win=3083 Len=384 TSval=703394169 TSecr=703394169"
"23","0.000751704","127.0.0.1","127.0.0.1","TCP","229","38492  >  5001 [PSH, ACK] Seq=1794 Ack=4225 Win=6146 Len=163 TSval=703394169 TSecr=703394169"
"24","0.000778968","127.0.0.1","127.0.0.1","TCP","450","5001  >  38492 [PSH, ACK] Seq=4225 Ack=1957 Win=3083 Len=384 TSval=703394169 TSecr=703394169"
"25","0.000807901","127.0.0.1","127.0.0.1","TCP","229","38492  >  5001 [PSH, ACK] Seq=1957 Ack=4609 Win=6146 Len=163 TSval=703394169 TSecr=703394169"
"26","0.000837361","127.0.0.1","127.0.0.1","TCP","450","5001  >  38492 [PSH, ACK] Seq=4609 Ack=2120 Win=3083 Len=384 TSval=703394169 TSecr=703394169"
"27","0.000861624","127.0.0.1","127.0.0.1","TCP","229","38492  >  5001 [PSH, ACK] Seq=2120 Ack=4993 Win=6146 Len=163 TSval=703394169 TSecr=703394169"
"28","0.000891705","127.0.0.1","127.0.0.1","TCP","450","5001  >  38492 [PSH, ACK] Seq=4993 Ack=2283 Win=3083 Len=384 TSval=703394169 TSecr=703394169"
"29","0.000922858","127.0.0.1","127.0.0.1","TCP","229","38492  >  5001 [PSH, ACK] Seq=2283 Ack=5377 Win=6146 Len=163 TSval=703394169 TSecr=703394169"
"30","0.000962281","127.0.0.1","127.0.0.1","TCP","450","5001  >  38492 [PSH, ACK] Seq=5377 Ack=2446 Win=3083 Len=384 TSval=703394169 TSecr=703394169"
"31","0.001001745","127.0.0.1","127.0.0.1","TCP","229","38492  >  5001 [PSH, ACK] Seq=2446 Ack=5761 Win=6146 Len=163 TSval=703394169 TSecr=703394169"
"32","0.001039368","127.0.0.1","127.0.0.1","TCP","450","5001  >  38492 [PSH, ACK] Seq=5761 Ack=2609 Win=3083 Len=384 TSval=703394169 TSecr=703394169"
"33","0.001082111","127.0.0.1","127.0.0.1","TCP","229","38492  >  5001 [PSH, ACK] Seq=2609 Ack=6145 Win=6146 Len=163 TSval=703394169 TSecr=703394169"
"34","0.001124951","127.0.0.1","127.0.0.1","TCP","450","5001  >  38492 [PSH, ACK] Seq=6145 Ack=2772 Win=3083 Len=384 TSval=703394169 TSecr=703394169"
"35","0.001160985","127.0.0.1","127.0.0.1","TCP","229","38492  >  5001 [PSH, ACK] Seq=2772 Ack=6529 Win=6146 Len=163 TSval=703394169 TSecr=703394169"
"36","0.001197436","127.0.0.1","127.0.0.1","TCP","450","5001  >  38492 [PSH, ACK] Seq=6529 Ack=2935 Win=3083 Len=384 TSval=703394169 TSecr=703394169"
"37","0.001233810","127.0.0.1","127.0.0.1","TCP","229","38492  >  5001 [PSH, ACK] Seq=2935 Ack=6913 Win=6146 Len=163 TSval=703394169 TSecr=703394169"
"38","0.001272027","127.0.0.1","127.0.0.1","TCP","450","5001  >  38492 [PSH, ACK] Seq=6913 Ack=3098 Win=3083 Len=384 TSval=703394169 TSecr=703394169"
"39","0.001313315","127.0.0.1","127.0.0.1","TCP","229","38492  >  5001 [PSH, ACK] Seq=3098 Ack=7297 Win=6146 Len=163 TSval=703394170 TSecr=703394169"
"40","0.001338406","127.0.0.1","127.0.0.1","TCP","450","5001  >  38492 [PSH, ACK] Seq=7297 Ack=3261 Win=3083 Len=384 TSval=703394170 TSecr=703394170"
"41","0.001361866","127.0.0.1","127.0.0.1","TCP","229","38492  >  5001 [PSH, ACK] Seq=3261 Ack=7681 Win=6146 Len=163 TSval=703394170 TSecr=703394170"
"42","0.001390011","127.0.0.1","127.0.0.1","TCP","450","5001  >  38492 [PSH, ACK] Seq=7681 Ack=3424 Win=3083 Len=384 TSval=703394170 TSecr=703394170"
"43","0.001417141","127.0.0.1","127.0.0.1","TCP","229","38492  >  5001 [PSH, ACK] Seq=3424 Ack=8065 Win=6146 Len=163 TSval=703394170 TSecr=703394170"
"44","0.001444431","127.0.0.1","127.0.0.1","TCP","450","5001  >  38492 [PSH, ACK] Seq=8065 Ack=3587 Win=3083 Len=384 TSval=703394170 TSecr=703394170"
"45","0.001545141","127.0.0.1","127.0.0.1","TCP","229","38492  >  5001 [PSH, ACK] Seq=3587 Ack=8449 Win=6146 Len=163 TSval=703394170 TSecr=703394170"
"46","0.001623438","127.0.0.1","127.0.0.1","TCP","450","5001  >  38492 [PSH, ACK] Seq=8449 Ack=3750 Win=3083 Len=384 TSval=703394170 TSecr=703394170"
"47","0.001669736","127.0.0.1","127.0.0.1","TCP","229","38492  >  5001 [PSH, ACK] Seq=3750 Ack=8833 Win=6146 Len=163 TSval=703394170 TSecr=703394170"
"48","0.001707313","127.0.0.1","127.0.0.1","TCP","450","5001  >  38492 [PSH, ACK] Seq=8833 Ack=3913 Win=3083 Len=384 TSval=703394170 TSecr=703394170"
"49","0.001765554","127.0.0.1","127.0.0.1","TCP","229","38492  >  5001 [PSH, ACK] Seq=3913 Ack=9217 Win=6146 Len=163 TSval=703394170 TSecr=703394170"
"50","0.001816729","127.0.0.1","127.0.0.1","TCP","450","5001  >  38492 [PSH, ACK] Seq=9217 Ack=4076 Win=3083 Len=384 TSval=703394170 TSecr=703394170"
"51","0.001914037","127.0.0.1","127.0.0.1","TCP","229","38492  >  5001 [PSH, ACK] Seq=4076 Ack=9601 Win=6146 Len=163 TSval=703394170 TSecr=703394170"
"52","0.002037376","127.0.0.1","127.0.0.1","TCP","450","5001  >  38492 [PSH, ACK] Seq=9601 Ack=4239 Win=3083 Len=384 TSval=703394170 TSecr=703394170"
"53","0.002102052","127.0.0.1","127.0.0.1","TCP","229","38492  >  5001 [PSH, ACK] Seq=4239 Ack=9985 Win=6146 Len=163 TSval=703394170 TSecr=703394170"
"54","0.002143212","127.0.0.1","127.0.0.1","TCP","450","5001  >  38492 [PSH, ACK] Seq=9985 Ack=4402 Win=3083 Len=384 TSval=703394170 TSecr=703394170"
"55","0.002174821","127.0.0.1","127.0.0.1","TCP","229","38492  >  5001 [PSH, ACK] Seq=4402 Ack=10369 Win=6146 Len=163 TSval=703394170 TSecr=703394170"
"56","0.002237422","127.0.0.1","127.0.0.1","TCP","450","5001  >  38492 [PSH, ACK] Seq=10369 Ack=4565 Win=3083 Len=384 TSval=703394170 TSecr=703394170"
"57","0.002293782","127.0.0.1","127.0.0.1","TCP","229","38492  >  5001 [PSH, ACK] Seq=4565 Ack=10753 Win=6146 Len=163 TSval=703394170 TSecr=703394170"
"58","0.002334767","127.0.0.1","127.0.0.1","TCP","450","5001  >  38492 [PSH, ACK] Seq=10753 Ack=4728 Win=3083 Len=384 TSval=703394171 TSecr=703394170"
"59","0.002368260","127.0.0.1","127.0.0.1","TCP","229","38492  >  5001 [PSH, ACK] Seq=4728 Ack=11137 Win=6146 Len=163 TSval=703394171 TSecr=703394171"
"60","0.002400136","127.0.0.1","127.0.0.1","TCP","450","5001  >  38492 [PSH, ACK] Seq=11137 Ack=4891 Win=3083 Len=384 TSval=703394171 TSecr=703394171"
"61","0.002474276","127.0.0.1","127.0.0.1","TCP","229","38492  >  5001 [PSH, ACK] Seq=4891 Ack=11521 Win=6146 Len=163 TSval=703394171 TSecr=703394171"
"62","0.002507509","127.0.0.1","127.0.0.1","TCP","450","5001  >  38492 [PSH, ACK] Seq=11521 Ack=5054 Win=3083 Len=384 TSval=703394171 TSecr=703394171"
"63","0.002564841","127.0.0.1","127.0.0.1","TCP","229","38492  >  5001 [PSH, ACK] Seq=5054 Ack=11905 Win=6146 Len=163 TSval=703394171 TSecr=703394171"
"64","0.002638824","127.0.0.1","127.0.0.1","TCP","450","5001  >  38492 [PSH, ACK] Seq=11905 Ack=5217 Win=3083 Len=384 TSval=703394171 TSecr=703394171"
"65","0.031402480","127.0.0.1","127.0.0.1","TCP","229","38492  >  5001 [PSH, ACK] Seq=5217 Ack=12289 Win=6146 Len=163 TSval=703394200 TSecr=703394171"
"66","0.031493188","127.0.0.1","127.0.0.1","TCP","450","5001  >  38492 [PSH, ACK] Seq=12289 Ack=5380 Win=3083 Len=384 TSval=703394200 TSecr=703394200"
"67","0.031548884","127.0.0.1","127.0.0.1","TCP","229","38492  >  5001 [PSH, ACK] Seq=5380 Ack=12673 Win=6146 Len=163 TSval=703394200 TSecr=703394200"
"68","0.031588023","127.0.0.1","127.0.0.1","TCP","450","5001  >  38492 [PSH, ACK] Seq=12673 Ack=5543 Win=3083 Len=384 TSval=703394200 TSecr=703394200"
"69","0.031638780","127.0.0.1","127.0.0.1","TCP","229","38492  >  5001 [PSH, ACK] Seq=5543 Ack=13057 Win=6146 Len=163 TSval=703394200 TSecr=703394200"
"70","0.031672157","127.0.0.1","127.0.0.1","TCP","450","5001  >  38492 [PSH, ACK] Seq=13057 Ack=5706 Win=3083 Len=384 TSval=703394200 TSecr=703394200"
"71","0.031704573","127.0.0.1","127.0.0.1","TCP","229","38492  >  5001 [PSH, ACK] Seq=5706 Ack=13441 Win=6146 Len=163 TSval=703394200 TSecr=703394200"
"72","0.031734923","127.0.0.1","127.0.0.1","TCP","450","5001  >  38492 [PSH, ACK] Seq=13441 Ack=5869 Win=3083 Len=384 TSval=703394200 TSecr=703394200"
"73","0.031760749","127.0.0.1","127.0.0.1","TCP","229","38492  >  5001 [PSH, ACK] Seq=5869 Ack=13825 Win=6146 Len=163 TSval=703394200 TSecr=703394200"
"74","0.031786159","127.0.0.1","127.0.0.1","TCP","450","5001  >  38492 [PSH, ACK] Seq=13825 Ack=6032 Win=3083 Len=384 TSval=703394200 TSecr=703394200"
"75","0.031810943","127.0.0.1","127.0.0.1","TCP","229","38492  >  5001 [PSH, ACK] Seq=6032 Ack=14209 Win=6146 Len=163 TSval=703394200 TSecr=703394200"
"76","0.031837508","127.0.0.1","127.0.0.1","TCP","450","5001  >  38492 [PSH, ACK] Seq=14209 Ack=6195 Win=3083 Len=384 TSval=703394200 TSecr=703394200"
"77","0.031874468","127.0.0.1","127.0.0.1","TCP","229","38492  >  5001 [PSH, ACK] Seq=6195 Ack=14593 Win=6146 Len=163 TSval=703394200 TSecr=703394200"
"78","0.031906795","127.0.0.1","127.0.0.1","TCP","450","5001  >  38492 [PSH, ACK] Seq=14593 Ack=6358 Win=3083 Len=384 TSval=703394200 TSecr=703394200"
"79","0.031936333","127.0.0.1","127.0.0.1","TCP","229","38492  >  5001 [PSH, ACK] Seq=6358 Ack=14977 Win=6146 Len=163 TSval=703394200 TSecr=703394200"
"80","0.031965504","127.0.0.1","127.0.0.1","TCP","450","5001  >  38492 [PSH, ACK] Seq=14977 Ack=6521 Win=3083 Len=384 TSval=703394200 TSecr=703394200"
"81","0.031991904","127.0.0.1","127.0.0.1","TCP","229","38492  >  5001 [PSH, ACK] Seq=6521 Ack=15361 Win=6146 Len=163 TSval=703394200 TSecr=703394200"
"82","0.032013972","127.0.0.1","127.0.0.1","TCP","450","5001  >  38492 [PSH, ACK] Seq=15361 Ack=6684 Win=3083 Len=384 TSval=703394200 TSecr=703394200"
"83","0.032040297","127.0.0.1","127.0.0.1","TCP","229","38492  >  5001 [PSH, ACK] Seq=6684 Ack=15745 Win=6146 Len=163 TSval=703394200 TSecr=703394200"
"84","0.032057802","127.0.0.1","127.0.0.1","TCP","450","5001  >  38492 [PSH, ACK] Seq=15745 Ack=6847 Win=3083 Len=384 TSval=703394200 TSecr=703394200"
"85","0.032081989","127.0.0.1","127.0.0.1","TCP","229","38492  >  5001 [PSH, ACK] Seq=6847 Ack=16129 Win=6146 Len=163 TSval=703394200 TSecr=703394200"
"86","0.032101608","127.0.0.1","127.0.0.1","TCP","450","5001  >  38492 [PSH, ACK] Seq=16129 Ack=7010 Win=3083 Len=384 TSval=703394200 TSecr=703394200"
"87","0.032124130","127.0.0.1","127.0.0.1","TCP","229","38492  >  5001 [PSH, ACK] Seq=7010 Ack=16513 Win=6146 Len=163 TSval=703394200 TSecr=703394200"
"88","0.032142777","127.0.0.1","127.0.0.1","TCP","450","5001  >  38492 [PSH, ACK] Seq=16513 Ack=7173 Win=3083 Len=384 TSval=703394200 TSecr=703394200"
"89","0.032164695","127.0.0.1","127.0.0.1","TCP","229","38492  >  5001 [PSH, ACK] Seq=7173 Ack=16897 Win=6146 Len=163 TSval=703394200 TSecr=703394200"
"90","0.032184408","127.0.0.1","127.0.0.1","TCP","450","5001  >  38492 [PSH, ACK] Seq=16897 Ack=7336 Win=3083 Len=384 TSval=703394200 TSecr=703394200"
"91","0.032211803","127.0.0.1","127.0.0.1","TCP","229","38492  >  5001 [PSH, ACK] Seq=7336 Ack=17281 Win=6146 Len=163 TSval=703394200 TSecr=703394200"
"92","0.032259996","127.0.0.1","127.0.0.1","TCP","450","5001  >  38492 [PSH, ACK] Seq=17281 Ack=7499 Win=3083 Len=384 TSval=703394200 TSecr=703394200"
"93","0.032295915","127.0.0.1","127.0.0.1","TCP","229","38492  >  5001 [PSH, ACK] Seq=7499 Ack=17665 Win=6146 Len=163 TSval=703394201 TSecr=703394200"
"94","0.032355141","127.0.0.1","127.0.0.1","TCP","450","5001  >  38492 [PSH, ACK] Seq=17665 Ack=7662 Win=3083 Len=384 TSval=703394201 TSecr=703394201"
"95","0.032383665","127.0.0.1","127.0.0.1","TCP","229","38492  >  5001 [PSH, ACK] Seq=7662 Ack=18049 Win=6146 Len=163 TSval=703394201 TSecr=703394201"
"96","0.032422658","127.0.0.1","127.0.0.1","TCP","450","5001  >  38492 [PSH, ACK] Seq=18049 Ack=7825 Win=3083 Len=384 TSval=703394201 TSecr=703394201"
"97","0.032449368","127.0.0.1","127.0.0.1","TCP","229","38492  >  5001 [PSH, ACK] Seq=7825 Ack=18433 Win=6146 Len=163 TSval=703394201 TSecr=703394201"
"98","0.032473951","127.0.0.1","127.0.0.1","TCP","450","5001  >  38492 [PSH, ACK] Seq=18433 Ack=7988 Win=3083 Len=384 TSval=703394201 TSecr=703394201"
"99","0.032499812","127.0.0.1","127.0.0.1","TCP","229","38492  >  5001 [PSH, ACK] Seq=7988 Ack=18817 Win=6146 Len=163 TSval=703394201 TSecr=703394201"
"100","0.032524148","127.0.0.1","127.0.0.1","TCP","450","5001  >  38492 [PSH, ACK] Seq=18817 Ack=8151 Win=3083 Len=384 TSval=703394201 TSecr=703394201"
"101","0.032553397","127.0.0.1","127.0.0.1","TCP","229","38492  >  5001 [PSH, ACK] Seq=8151 Ack=19201 Win=6146 Len=163 TSval=703394201 TSecr=703394201"
"102","0.032582153","127.0.0.1","127.0.0.1","TCP","450","5001  >  38492 [PSH, ACK] Seq=19201 Ack=8314 Win=3083 Len=384 TSval=703394201 TSecr=703394201"
"103","0.032609065","127.0.0.1","127.0.0.1","TCP","229","38492  >  5001 [PSH, ACK] Seq=8314 Ack=19585 Win=6146 Len=163 TSval=703394201 TSecr=703394201"
"104","0.032638284","127.0.0.1","127.0.0.1","TCP","450","5001  >  38492 [PSH, ACK] Seq=19585 Ack=8477 Win=3083 Len=384 TSval=703394201 TSecr=703394201"
"105","0.033094542","127.0.0.1","127.0.0.1","TCP","229","38492  >  5001 [PSH, ACK] Seq=8477 Ack=19969 Win=6146 Len=163 TSval=703394201 TSecr=703394201"
"106","0.033157845","127.0.0.1","127.0.0.1","TCP","450","5001  >  38492 [PSH, ACK] Seq=19969 Ack=8640 Win=3083 Len=384 TSval=703394201 TSecr=703394201"
"107","0.033188245","127.0.0.1","127.0.0.1","TCP","229","38492  >  5001 [PSH, ACK] Seq=8640 Ack=20353 Win=6146 Len=163 TSval=703394201 TSecr=703394201"
"108","0.033219157","127.0.0.1","127.0.0.1","TCP","450","5001  >  38492 [PSH, ACK] Seq=20353 Ack=8803 Win=3083 Len=384 TSval=703394201 TSecr=703394201"
"109","0.033250164","127.0.0.1","127.0.0.1","TCP","229","38492  >  5001 [PSH, ACK] Seq=8803 Ack=20737 Win=6146 Len=163 TSval=703394201 TSecr=703394201"
"110","0.033287672","127.0.0.1","127.0.0.1","TCP","450","5001  >  38492 [PSH, ACK] Seq=20737 Ack=8966 Win=3083 Len=384 TSval=703394202 TSecr=703394201"
"111","0.033319422","127.0.0.1","127.0.0.1","TCP","229","38492  >  5001 [PSH, ACK] Seq=8966 Ack=21121 Win=6146 Len=163 TSval=703394202 TSecr=703394202"
"112","0.033356512","127.0.0.1","127.0.0.1","TCP","450","5001  >  38492 [PSH, ACK] Seq=21121 Ack=9129 Win=3083 Len=384 TSval=703394202 TSecr=703394202"
"113","0.033392839","127.0.0.1","127.0.0.1","TCP","229","38492  >  5001 [PSH, ACK] Seq=9129 Ack=21505 Win=6146 Len=163 TSval=703394202 TSecr=703394202"
"114","0.033424199","127.0.0.1","127.0.0.1","TCP","450","5001  >  38492 [PSH, ACK] Seq=21505 Ack=9292 Win=3083 Len=384 TSval=703394202 TSecr=703394202"
"115","0.033450267","127.0.0.1","127.0.0.1","TCP","229","38492  >  5001 [PSH, ACK] Seq=9292 Ack=21889 Win=6146 Len=163 TSval=703394202 TSecr=703394202"
"116","0.033477184","127.0.0.1","127.0.0.1","TCP","450","5001  >  38492 [PSH, ACK] Seq=21889 Ack=9455 Win=3083 Len=384 TSval=703394202 TSecr=703394202"
"117","0.033501648","127.0.0.1","127.0.0.1","TCP","229","38492  >  5001 [PSH, ACK] Seq=9455 Ack=22273 Win=6146 Len=163 TSval=703394202 TSecr=703394202"
"118","0.033529456","127.0.0.1","127.0.0.1","TCP","450","5001  >  38492 [PSH, ACK] Seq=22273 Ack=9618 Win=3083 Len=384 TSval=703394202 TSecr=703394202"
"119","0.033554044","127.0.0.1","127.0.0.1","TCP","229","38492  >  5001 [PSH, ACK] Seq=9618 Ack=22657 Win=6146 Len=163 TSval=703394202 TSecr=703394202"
"120","0.033580136","127.0.0.1","127.0.0.1","TCP","450","5001  >  38492 [PSH, ACK] Seq=22657 Ack=9781 Win=3083 Len=384 TSval=703394202 TSecr=703394202"
"121","0.033602681","127.0.0.1","127.0.0.1","TCP","229","38492  >  5001 [PSH, ACK] Seq=9781 Ack=23041 Win=6146 Len=163 TSval=703394202 TSecr=703394202"
"122","0.033627549","127.0.0.1","127.0.0.1","TCP","450","5001  >  38492 [PSH, ACK] Seq=23041 Ack=9944 Win=3083 Len=384 TSval=703394202 TSecr=703394202"
"123","0.033648467","127.0.0.1","127.0.0.1","TCP","229","38492  >  5001 [PSH, ACK] Seq=9944 Ack=23425 Win=6146 Len=163 TSval=703394202 TSecr=703394202"
"124","0.033673321","127.0.0.1","127.0.0.1","TCP","450","5001  >  38492 [PSH, ACK] Seq=23425 Ack=10107 Win=3083 Len=384 TSval=703394202 TSecr=703394202"
"125","0.033696767","127.0.0.1","127.0.0.1","TCP","229","38492  >  5001 [PSH, ACK] Seq=10107 Ack=23809 Win=6146 Len=163 TSval=703394202 TSecr=703394202"
"126","0.033726451","127.0.0.1","127.0.0.1","TCP","450","5001  >  38492 [PSH, ACK] Seq=23809 Ack=10270 Win=3083 Len=384 TSval=703394202 TSecr=703394202"
"127","0.033748040","127.0.0.1","127.0.0.1","TCP","229","38492  >  5001 [PSH, ACK] Seq=10270 Ack=24193 Win=6146 Len=163 TSval=703394202 TSecr=703394202"
"128","0.033775155","127.0.0.1","127.0.0.1","TCP","450","5001  >  38492 [PSH, ACK] Seq=24193 Ack=10433 Win=3083 Len=384 TSval=703394202 TSecr=703394202"
"129","0.033800797","127.0.0.1","127.0.0.1","TCP","229","38492  >  5001 [PSH, ACK] Seq=10433 Ack=24577 Win=6146 Len=163 TSval=703394202 TSecr=703394202"
"130","0.033828328","127.0.0.1","127.0.0.1","TCP","450","5001  >  38492 [PSH, ACK] Seq=24577 Ack=10596 Win=3083 Len=384 TSval=703394202 TSecr=703394202"
"131","0.033855835","127.0.0.1","127.0.0.1","TCP","229","38492  >  5001 [PSH, ACK] Seq=10596 Ack=24961 Win=6146 Len=163 TSval=703394202 TSecr=703394202"
"132","0.033890795","127.0.0.1","127.0.0.1","TCP","450","5001  >  38492 [PSH, ACK] Seq=24961 Ack=10759 Win=3083 Len=384 TSval=703394202 TSecr=703394202"
"133","0.033923615","127.0.0.1","127.0.0.1","TCP","229","38492  >  5001 [PSH, ACK] Seq=10759 Ack=25345 Win=6146 Len=163 TSval=703394202 TSecr=703394202"
"134","0.033957266","127.0.0.1","127.0.0.1","TCP","450","5001  >  38492 [PSH, ACK] Seq=25345 Ack=10922 Win=3083 Len=384 TSval=703394202 TSecr=703394202"
"135","0.033991894","127.0.0.1","127.0.0.1","TCP","229","38492  >  5001 [PSH, ACK] Seq=10922 Ack=25729 Win=6146 Len=163 TSval=703394202 TSecr=703394202"
"136","0.034027468","127.0.0.1","127.0.0.1","TCP","450","5001  >  38492 [PSH, ACK] Seq=25729 Ack=11085 Win=3083 Len=384 TSval=703394202 TSecr=703394202"
"137","0.034058982","127.0.0.1","127.0.0.1","TCP","229","38492  >  5001 [PSH, ACK] Seq=11085 Ack=26113 Win=6146 Len=163 TSval=703394202 TSecr=703394202"
"138","0.034087341","127.0.0.1","127.0.0.1","TCP","450","5001  >  38492 [PSH, ACK] Seq=26113 Ack=11248 Win=3083 Len=384 TSval=703394202 TSecr=703394202"
"139","0.034116670","127.0.0.1","127.0.0.1","TCP","229","38492  >  5001 [PSH, ACK] Seq=11248 Ack=26497 Win=6146 Len=163 TSval=703394202 TSecr=703394202"
"140","0.034152233","127.0.0.1","127.0.0.1","TCP","450","5001  >  38492 [PSH, ACK] Seq=26497 Ack=11411 Win=3083 Len=384 TSval=703394202 TSecr=703394202"
"141","0.034174819","127.0.0.1","127.0.0.1","TCP","229","38492  >  5001 [PSH, ACK] Seq=11411 Ack=26881 Win=6146 Len=163 TSval=703394202 TSecr=703394202"
"142","0.034202377","127.0.0.1","127.0.0.1","TCP","450","5001  >  38492 [PSH, ACK] Seq=26881 Ack=11574 Win=3083 Len=384 TSval=703394202 TSecr=703394202"
"143","0.034221572","127.0.0.1","127.0.0.1","TCP","229","38492  >  5001 [PSH, ACK] Seq=11574 Ack=27265 Win=6146 Len=163 TSval=703394202 TSecr=703394202"
"144","0.034248049","127.0.0.1","127.0.0.1","TCP","450","5001  >  38492 [PSH, ACK] Seq=27265 Ack=11737 Win=3083 Len=384 TSval=703394202 TSecr=703394202"
"145","0.034268777","127.0.0.1","127.0.0.1","TCP","229","38492  >  5001 [PSH, ACK] Seq=11737 Ack=27649 Win=6146 Len=163 TSval=703394202 TSecr=703394202"
"146","0.034294546","127.0.0.1","127.0.0.1","TCP","450","5001  >  38492 [PSH, ACK] Seq=27649 Ack=11900 Win=3083 Len=384 TSval=703394203 TSecr=703394202"
"147","0.034314898","127.0.0.1","127.0.0.1","TCP","229","38492  >  5001 [PSH, ACK] Seq=11900 Ack=28033 Win=6146 Len=163 TSval=703394203 TSecr=703394203"
"148","0.034338723","127.0.0.1","127.0.0.1","TCP","450","5001  >  38492 [PSH, ACK] Seq=28033 Ack=12063 Win=3083 Len=384 TSval=703394203 TSecr=703394203"
"149","0.034358977","127.0.0.1","127.0.0.1","TCP","229","38492  >  5001 [PSH, ACK] Seq=12063 Ack=28417 Win=6146 Len=163 TSval=703394203 TSecr=703394203"
"150","0.034393427","127.0.0.1","127.0.0.1","TCP","450","5001  >  38492 [PSH, ACK] Seq=28417 Ack=12226 Win=3083 Len=384 TSval=703394203 TSecr=703394203"
"151","0.034435129","127.0.0.1","127.0.0.1","TCP","229","38492  >  5001 [PSH, ACK] Seq=12226 Ack=28801 Win=6146 Len=163 TSval=703394203 TSecr=703394203"
"152","0.034484302","127.0.0.1","127.0.0.1","TCP","450","5001  >  38492 [PSH, ACK] Seq=28801 Ack=12389 Win=3083 Len=384 TSval=703394203 TSecr=703394203"
"153","0.034527395","127.0.0.1","127.0.0.1","TCP","229","38492  >  5001 [PSH, ACK] Seq=12389 Ack=29185 Win=6146 Len=163 TSval=703394203 TSecr=703394203"
"154","0.034573106","127.0.0.1","127.0.0.1","TCP","450","5001  >  38492 [PSH, ACK] Seq=29185 Ack=12552 Win=3083 Len=384 TSval=703394203 TSecr=703394203"
"155","0.034600837","127.0.0.1","127.0.0.1","TCP","229","38492  >  5001 [PSH, ACK] Seq=12552 Ack=29569 Win=6146 Len=163 TSval=703394203 TSecr=703394203"
"156","0.034618803","127.0.0.1","127.0.0.1","TCP","450","5001  >  38492 [PSH, ACK] Seq=29569 Ack=12715 Win=3083 Len=384 TSval=703394203 TSecr=703394203"
"157","0.034641089","127.0.0.1","127.0.0.1","TCP","229","38492  >  5001 [PSH, ACK] Seq=12715 Ack=29953 Win=6146 Len=163 TSval=703394203 TSecr=703394203"
"158","0.034667741","127.0.0.1","127.0.0.1","TCP","450","5001  >  38492 [PSH, ACK] Seq=29953 Ack=12878 Win=3083 Len=384 TSval=703394203 TSecr=703394203"
"159","0.034694505","127.0.0.1","127.0.0.1","TCP","229","38492  >  5001 [PSH, ACK] Seq=12878 Ack=30337 Win=6146 Len=163 TSval=703394203 TSecr=703394203"
"160","0.034728302","127.0.0.1","127.0.0.1","TCP","450","5001  >  38492 [PSH, ACK] Seq=30337 Ack=13041 Win=3083 Len=384 TSval=703394203 TSecr=703394203"
"161","0.034760123","127.0.0.1","127.0.0.1","TCP","229","38492  >  5001 [PSH, ACK] Seq=13041 Ack=30721 Win=6146 Len=163 TSval=703394203 TSecr=703394203"
"162","0.034790786","127.0.0.1","127.0.0.1","TCP","450","5001  >  38492 [PSH, ACK] Seq=30721 Ack=13204 Win=3083 Len=384 TSval=703394203 TSecr=703394203"
"163","0.034817924","127.0.0.1","127.0.0.1","TCP","229","38492  >  5001 [PSH, ACK] Seq=13204 Ack=31105 Win=6146 Len=163 TSval=703394203 TSecr=703394203"
"164","0.034849979","127.0.0.1","127.0.0.1","TCP","450","5001  >  38492 [PSH, ACK] Seq=31105 Ack=13367 Win=3083 Len=384 TSval=703394203 TSecr=703394203"
"165","0.034890456","127.0.0.1","127.0.0.1","TCP","229","38492  >  5001 [PSH, ACK] Seq=13367 Ack=31489 Win=6146 Len=163 TSval=703394203 TSecr=703394203"
"166","0.034926015","127.0.0.1","127.0.0.1","TCP","450","5001  >  38492 [PSH, ACK] Seq=31489 Ack=13530 Win=3083 Len=384 TSval=703394203 TSecr=703394203"
"167","0.034956376","127.0.0.1","127.0.0.1","TCP","229","38492  >  5001 [PSH, ACK] Seq=13530 Ack=31873 Win=6146 Len=163 TSval=703394203 TSecr=703394203"
"168","0.034988404","127.0.0.1","127.0.0.1","TCP","450","5001  >  38492 [PSH, ACK] Seq=31873 Ack=13693 Win=3083 Len=384 TSval=703394203 TSecr=703394203"
"169","0.035025744","127.0.0.1","127.0.0.1","TCP","229","38492  >  5001 [PSH, ACK] Seq=13693 Ack=32257 Win=6146 Len=163 TSval=703394203 TSecr=703394203"
"170","0.035059395","127.0.0.1","127.0.0.1","TCP","450","5001  >  38492 [PSH, ACK] Seq=32257 Ack=13856 Win=3083 Len=384 TSval=703394203 TSecr=703394203"
"171","0.035108737","127.0.0.1","127.0.0.1","TCP","229","38492  >  5001 [PSH, ACK] Seq=13856 Ack=32641 Win=6146 Len=163 TSval=703394203 TSecr=703394203"
"172","0.035155647","127.0.0.1","127.0.0.1","TCP","450","5001  >  38492 [PSH, ACK] Seq=32641 Ack=14019 Win=3083 Len=384 TSval=703394203 TSecr=703394203"
"173","0.035204789","127.0.0.1","127.0.0.1","TCP","229","38492  >  5001 [PSH, ACK] Seq=14019 Ack=33025 Win=6146 Len=163 TSval=703394203 TSecr=703394203"
"174","0.035240126","127.0.0.1","127.0.0.1","TCP","450","5001  >  38492 [PSH, ACK] Seq=33025 Ack=14182 Win=3083 Len=384 TSval=703394203 TSecr=703394203"
"175","0.035264159","127.0.0.1","127.0.0.1","TCP","229","38492  >  5001 [PSH, ACK] Seq=14182 Ack=33409 Win=6146 Len=163 TSval=703394203 TSecr=703394203"
"176","0.035284516","127.0.0.1","127.0.0.1","TCP","450","5001  >  38492 [PSH, ACK] Seq=33409 Ack=14345 Win=3083 Len=384 TSval=703394204 TSecr=703394203"
"177","0.035301394","127.0.0.1","127.0.0.1","TCP","229","38492  >  5001 [PSH, ACK] Seq=14345 Ack=33793 Win=6146 Len=163 TSval=703394204 TSecr=703394204"
"178","0.035320682","127.0.0.1","127.0.0.1","TCP","450","5001  >  38492 [PSH, ACK] Seq=33793 Ack=14508 Win=3083 Len=384 TSval=703394204 TSecr=703394204"
"179","0.035339607","127.0.0.1","127.0.0.1","TCP","229","38492  >  5001 [PSH, ACK] Seq=14508 Ack=34177 Win=6146 Len=163 TSval=703394204 TSecr=703394204"
"180","0.035358968","127.0.0.1","127.0.0.1","TCP","450","5001  >  38492 [PSH, ACK] Seq=34177 Ack=14671 Win=3083 Len=384 TSval=703394204 TSecr=703394204"
"181","0.035378022","127.0.0.1","127.0.0.1","TCP","229","38492  >  5001 [PSH, ACK] Seq=14671 Ack=34561 Win=6146 Len=163 TSval=703394204 TSecr=703394204"
"182","0.035396615","127.0.0.1","127.0.0.1","TCP","450","5001  >  38492 [PSH, ACK] Seq=34561 Ack=14834 Win=3083 Len=384 TSval=703394204 TSecr=703394204"
"183","0.035415375","127.0.0.1","127.0.0.1","TCP","229","38492  >  5001 [PSH, ACK] Seq=14834 Ack=34945 Win=6146 Len=163 TSval=703394204 TSecr=703394204"
"184","0.035434154","127.0.0.1","127.0.0.1","TCP","450","5001  >  38492 [PSH, ACK] Seq=34945 Ack=14997 Win=3083 Len=384 TSval=703394204 TSecr=703394204"
"185","0.035453210","127.0.0.1","127.0.0.1","TCP","229","38492  >  5001 [PSH, ACK] Seq=14997 Ack=35329 Win=6146 Len=163 TSval=703394204 TSecr=703394204"
"186","0.035472310","127.0.0.1","127.0.0.1","TCP","450","5001  >  38492 [PSH, ACK] Seq=35329 Ack=15160 Win=3083 Len=384 TSval=703394204 TSecr=703394204"
"187","0.035491208","127.0.0.1","127.0.0.1","TCP","229","38492  >  5001 [PSH, ACK] Seq=15160 Ack=35713 Win=6146 Len=163 TSval=703394204 TSecr=703394204"
"188","0.035510251","127.0.0.1","127.0.0.1","TCP","450","5001  >  38492 [PSH, ACK] Seq=35713 Ack=15323 Win=3083 Len=384 TSval=703394204 TSecr=703394204"
"189","0.035529191","127.0.0.1","127.0.0.1","TCP","229","38492  >  5001 [PSH, ACK] Seq=15323 Ack=36097 Win=6146 Len=163 TSval=703394204 TSecr=703394204"
"190","0.035548401","127.0.0.1","127.0.0.1","TCP","450","5001  >  38492 [PSH, ACK] Seq=36097 Ack=15486 Win=3083 Len=384 TSval=703394204 TSecr=703394204"
"191","0.035567634","127.0.0.1","127.0.0.1","TCP","229","38492  >  5001 [PSH, ACK] Seq=15486 Ack=36481 Win=6146 Len=163 TSval=703394204 TSecr=703394204"
"192","0.035587194","127.0.0.1","127.0.0.1","TCP","450","5001  >  38492 [PSH, ACK] Seq=36481 Ack=15649 Win=3083 Len=384 TSval=703394204 TSecr=703394204"
"193","0.035606330","127.0.0.1","127.0.0.1","TCP","229","38492  >  5001 [PSH, ACK] Seq=15649 Ack=36865 Win=6146 Len=163 TSval=703394204 TSecr=703394204"
"194","0.035625045","127.0.0.1","127.0.0.1","TCP","450","5001  >  38492 [PSH, ACK] Seq=36865 Ack=15812 Win=3083 Len=384 TSval=703394204 TSecr=703394204"
"195","0.035643976","127.0.0.1","127.0.0.1","TCP","229","38492  >  5001 [PSH, ACK] Seq=15812 Ack=37249 Win=6146 Len=163 TSval=703394204 TSecr=703394204"
"196","0.035663345","127.0.0.1","127.0.0.1","TCP","450","5001  >  38492 [PSH, ACK] Seq=37249 Ack=15975 Win=3083 Len=384 TSval=703394204 TSecr=703394204"
"197","0.035686797","127.0.0.1","127.0.0.1","TCP","229","38492  >  5001 [PSH, ACK] Seq=15975 Ack=37633 Win=6146 Len=163 TSval=703394204 TSecr=703394204"
"198","0.035708940","127.0.0.1","127.0.0.1","TCP","450","5001  >  38492 [PSH, ACK] Seq=37633 Ack=16138 Win=3083 Len=384 TSval=703394204 TSecr=703394204"
"199","0.035728620","127.0.0.1","127.0.0.1","TCP","229","38492  >  5001 [PSH, ACK] Seq=16138 Ack=38017 Win=6146 Len=163 TSval=703394204 TSecr=703394204"
"200","0.035745058","127.0.0.1","127.0.0.1","TCP","450","5001  >  38492 [PSH, ACK] Seq=38017 Ack=16301 Win=3083 Len=384 TSval=703394204 TSecr=703394204"
"201","0.035763979","127.0.0.1","127.0.0.1","TCP","229","38492  >  5001 [PSH, ACK] Seq=16301 Ack=38401 Win=6146 Len=163 TSval=703394204 TSecr=703394204"
"202","0.035780114","127.0.0.1","127.0.0.1","TCP","450","5001  >  38492 [PSH, ACK] Seq=38401 Ack=16464 Win=3083 Len=384 TSval=703394204 TSecr=703394204"
"203","0.035798981","127.0.0.1","127.0.0.1","TCP","229","38492  >  5001 [PSH, ACK] Seq=16464 Ack=38785 Win=6146 Len=163 TSval=703394204 TSecr=703394204"
"204","0.035815038","127.0.0.1","127.0.0.1","TCP","450","5001  >  38492 [PSH, ACK] Seq=38785 Ack=16627 Win=3083 Len=384 TSval=703394204 TSecr=703394204"
"205","0.035834158","127.0.0.1","127.0.0.1","TCP","229","38492  >  5001 [PSH, ACK] Seq=16627 Ack=39169 Win=6146 Len=163 TSval=703394204 TSecr=703394204"
"206","0.035850078","127.0.0.1","127.0.0.1","TCP","450","5001  >  38492 [PSH, ACK] Seq=39169 Ack=16790 Win=3083 Len=384 TSval=703394204 TSecr=703394204"
"207","0.035868895","127.0.0.1","127.0.0.1","TCP","229","38492  >  5001 [PSH, ACK] Seq=16790 Ack=39553 Win=6146 Len=163 TSval=703394204 TSecr=703394204"
"208","0.035885042","127.0.0.1","127.0.0.1","TCP","450","5001  >  38492 [PSH, ACK] Seq=39553 Ack=16953 Win=3083 Len=384 TSval=703394204 TSecr=703394204"
"209","0.035903849","127.0.0.1","127.0.0.1","TCP","229","38492  >  5001 [PSH, ACK] Seq=16953 Ack=39937 Win=6146 Len=163 TSval=703394204 TSecr=703394204"
"210","0.035919786","127.0.0.1","127.0.0.1","TCP","450","5001  >  38492 [PSH, ACK] Seq=39937 Ack=17116 Win=3083 Len=384 TSval=703394204 TSecr=703394204"
"211","0.035938520","127.0.0.1","127.0.0.1","TCP","229","38492  >  5001 [PSH, ACK] Seq=17116 Ack=40321 Win=6146 Len=163 TSval=703394204 TSecr=703394204"
"212","0.035954560","127.0.0.1","127.0.0.1","TCP","450","5001  >  38492 [PSH, ACK] Seq=40321 Ack=17279 Win=3083 Len=384 TSval=703394204 TSecr=703394204"
"213","0.035973423","127.0.0.1","127.0.0.1","TCP","229","38492  >  5001 [PSH, ACK] Seq=17279 Ack=40705 Win=6146 Len=163 TSval=703394204 TSecr=703394204"
"214","0.035989512","127.0.0.1","127.0.0.1","TCP","450","5001  >  38492 [PSH, ACK] Seq=40705 Ack=17442 Win=3083 Len=384 TSval=703394204 TSecr=703394204"
"215","0.036008252","127.0.0.1","127.0.0.1","TCP","229","38492  >  5001 [PSH, ACK] Seq=17442 Ack=41089 Win=6146 Len=163 TSval=703394204 TSecr=703394204"
"216","0.036033556","127.0.0.1","127.0.0.1","TCP","450","5001  >  38492 [PSH, ACK] Seq=41089 Ack=17605 Win=3083 Len=384 TSval=703394204 TSecr=703394204"
"217","0.036069739","127.0.0.1","127.0.0.1","TCP","229","38492  >  5001 [PSH, ACK] Seq=17605 Ack=41473 Win=6146 Len=163 TSval=703394204 TSecr=703394204"
"218","0.036090641","127.0.0.1","127.0.0.1","TCP","450","5001  >  38492 [PSH, ACK] Seq=41473 Ack=17768 Win=3083 Len=384 TSval=703394204 TSecr=703394204"
"219","0.036143663","127.0.0.1","127.0.0.1","TCP","229","38492  >  5001 [PSH, ACK] Seq=17768 Ack=41857 Win=6146 Len=163 TSval=703394204 TSecr=703394204"
"220","0.036169199","127.0.0.1","127.0.0.1","TCP","450","5001  >  38492 [PSH, ACK] Seq=41857 Ack=17931 Win=3083 Len=384 TSval=703394204 TSecr=703394204"
"221","0.038910043","127.0.0.1","127.0.0.1","TCP","229","38492  >  5001 [PSH, ACK] Seq=17931 Ack=42241 Win=6146 Len=163 TSval=703394207 TSecr=703394204"
"222","0.038972286","127.0.0.1","127.0.0.1","TCP","450","5001  >  38492 [PSH, ACK] Seq=42241 Ack=18094 Win=3083 Len=384 TSval=703394207 TSecr=703394207"
"223","0.039013894","127.0.0.1","127.0.0.1","TCP","229","38492  >  5001 [PSH, ACK] Seq=18094 Ack=42625 Win=6146 Len=163 TSval=703394207 TSecr=703394207"
"224","0.039035876","127.0.0.1","127.0.0.1","TCP","450","5001  >  38492 [PSH, ACK] Seq=42625 Ack=18257 Win=3083 Len=384 TSval=703394207 TSecr=703394207"
"225","0.039079225","127.0.0.1","127.0.0.1","TCP","229","38492  >  5001 [PSH, ACK] Seq=18257 Ack=43009 Win=6146 Len=163 TSval=703394207 TSecr=703394207"
"226","0.039099373","127.0.0.1","127.0.0.1","TCP","450","5001  >  38492 [PSH, ACK] Seq=43009 Ack=18420 Win=3083 Len=384 TSval=703394207 TSecr=703394207"
"227","0.039123816","127.0.0.1","127.0.0.1","TCP","229","38492  >  5001 [PSH, ACK] Seq=18420 Ack=43393 Win=6146 Len=163 TSval=703394207 TSecr=703394207"
"228","0.039143206","127.0.0.1","127.0.0.1","TCP","450","5001  >  38492 [PSH, ACK] Seq=43393 Ack=18583 Win=3083 Len=384 TSval=703394207 TSecr=703394207"
"229","0.039167066","127.0.0.1","127.0.0.1","TCP","229","38492  >  5001 [PSH, ACK] Seq=18583 Ack=43777 Win=6146 Len=163 TSval=703394207 TSecr=703394207"
"230","0.039186519","127.0.0.1","127.0.0.1","TCP","450","5001  >  38492 [PSH, ACK] Seq=43777 Ack=18746 Win=3083 Len=384 TSval=703394207 TSecr=703394207"
"231","0.039210081","127.0.0.1","127.0.0.1","TCP","229","38492  >  5001 [PSH, ACK] Seq=18746 Ack=44161 Win=6146 Len=163 TSval=703394207 TSecr=703394207"
"232","0.039229500","127.0.0.1","127.0.0.1","TCP","450","5001  >  38492 [PSH, ACK] Seq=44161 Ack=18909 Win=3083 Len=384 TSval=703394207 TSecr=703394207"
"233","0.039253094","127.0.0.1","127.0.0.1","TCP","229","38492  >  5001 [PSH, ACK] Seq=18909 Ack=44545 Win=6146 Len=163 TSval=703394207 TSecr=703394207"
"234","0.039272366","127.0.0.1","127.0.0.1","TCP","450","5001  >  38492 [PSH, ACK] Seq=44545 Ack=19072 Win=3083 Len=384 TSval=703394207 TSecr=703394207"
"235","0.039293335","127.0.0.1","127.0.0.1","TCP","229","38492  >  5001 [PSH, ACK] Seq=19072 Ack=44929 Win=6146 Len=163 TSval=703394208 TSecr=703394207"
"236","0.039312503","127.0.0.1","127.0.0.1","TCP","450","5001  >  38492 [PSH, ACK] Seq=44929 Ack=19235 Win=3083 Len=384 TSval=703394208 TSecr=703394208"
"237","0.039333377","127.0.0.1","127.0.0.1","TCP","229","38492  >  5001 [PSH, ACK] Seq=19235 Ack=45313 Win=6146 Len=163 TSval=703394208 TSecr=703394208"
"238","0.039352763","127.0.0.1","127.0.0.1","TCP","450","5001  >  38492 [PSH, ACK] Seq=45313 Ack=19398 Win=3083 Len=384 TSval=703394208 TSecr=703394208"
"239","0.039373426","127.0.0.1","127.0.0.1","TCP","229","38492  >  5001 [PSH, ACK] Seq=19398 Ack=45697 Win=6146 Len=163 TSval=703394208 TSecr=703394208"
"240","0.039392757","127.0.0.1","127.0.0.1","TCP","450","5001  >  38492 [PSH, ACK] Seq=45697 Ack=19561 Win=3083 Len=384 TSval=703394208 TSecr=703394208"
"241","0.054864183","127.0.0.1","127.0.0.1","TCP","229","38492  >  5001 [PSH, ACK] Seq=19561 Ack=46081 Win=6146 Len=163 TSval=703394223 TSecr=703394208"
"242","0.055126972","127.0.0.1","127.0.0.1","TCP","450","5001  >  38492 [PSH, ACK] Seq=46081 Ack=19724 Win=3083 Len=384 TSval=703394223 TSecr=703394223"
"243","0.055277131","127.0.0.1","127.0.0.1","TCP","229","38492  >  5001 [PSH, ACK] Seq=19724 Ack=46465 Win=6146 Len=163 TSval=703394223 TSecr=703394223"
"244","0.055340877","127.0.0.1","127.0.0.1","TCP","450","5001  >  38492 [PSH, ACK] Seq=46465 Ack=19887 Win=3083 Len=384 TSval=703394224 TSecr=703394223"
"245","0.055412078","127.0.0.1","127.0.0.1","TCP","229","38492  >  5001 [PSH, ACK] Seq=19887 Ack=46849 Win=6146 Len=163 TSval=703394224 TSecr=703394224"
"246","0.055449404","127.0.0.1","127.0.0.1","TCP","450","5001  >  38492 [PSH, ACK] Seq=46849 Ack=20050 Win=3083 Len=384 TSval=703394224 TSecr=703394224"
"247","0.055534870","127.0.0.1","127.0.0.1","TCP","229","38492  >  5001 [PSH, ACK] Seq=20050 Ack=47233 Win=6146 Len=163 TSval=703394224 TSecr=703394224"
"248","0.055616992","127.0.0.1","127.0.0.1","TCP","450","5001  >  38492 [PSH, ACK] Seq=47233 Ack=20213 Win=3083 Len=384 TSval=703394224 TSecr=703394224"
"249","0.055719596","127.0.0.1","127.0.0.1","TCP","229","38492  >  5001 [PSH, ACK] Seq=20213 Ack=47617 Win=6146 Len=163 TSval=703394224 TSecr=703394224"
"250","0.055754767","127.0.0.1","127.0.0.1","TCP","450","5001  >  38492 [PSH, ACK] Seq=47617 Ack=20376 Win=3083 Len=384 TSval=703394224 TSecr=703394224"
"251","0.055792215","127.0.0.1","127.0.0.1","TCP","229","38492  >  5001 [PSH, ACK] Seq=20376 Ack=48001 Win=6146 Len=163 TSval=703394224 TSecr=703394224"
"252","0.055834637","127.0.0.1","127.0.0.1","TCP","450","5001  >  38492 [PSH, ACK] Seq=48001 Ack=20539 Win=3083 Len=384 TSval=703394224 TSecr=703394224"
"253","0.055874042","127.0.0.1","127.0.0.1","TCP","229","38492  >  5001 [PSH, ACK] Seq=20539 Ack=48385 Win=6146 Len=163 TSval=703394224 TSecr=703394224"
"254","0.055956655","127.0.0.1","127.0.0.1","TCP","450","5001  >  38492 [PSH, ACK] Seq=48385 Ack=20702 Win=3083 Len=384 TSval=703394224 TSecr=703394224"
"255","0.055998601","127.0.0.1","127.0.0.1","TCP","229","38492  >  5001 [PSH, ACK] Seq=20702 Ack=48769 Win=6146 Len=163 TSval=703394224 TSecr=703394224"
"256","0.056031749","127.0.0.1","127.0.0.1","TCP","450","5001  >  38492 [PSH, ACK] Seq=48769 Ack=20865 Win=3083 Len=384 TSval=703394224 TSecr=703394224"
"257","0.056056571","127.0.0.1","127.0.0.1","TCP","229","38492  >  5001 [PSH, ACK] Seq=20865 Ack=49153 Win=6146 Len=163 TSval=703394224 TSecr=703394224"
"258","0.056084047","127.0.0.1","127.0.0.1","TCP","450","5001  >  38492 [PSH, ACK] Seq=49153 Ack=21028 Win=3083 Len=384 TSval=703394224 TSecr=703394224"
"259","0.056110069","127.0.0.1","127.0.0.1","TCP","229","38492  >  5001 [PSH, ACK] Seq=21028 Ack=49537 Win=6146 Len=163 TSval=703394224 TSecr=703394224"
"260","0.056139337","127.0.0.1","127.0.0.1","TCP","450","5001  >  38492 [PSH, ACK] Seq=49537 Ack=21191 Win=3083 Len=384 TSval=703394224 TSecr=703394224"
"261","0.079796014","127.0.0.1","127.0.0.1","TCP","229","38492  >  5001 [PSH, ACK] Seq=21191 Ack=49921 Win=6146 Len=163 TSval=703394248 TSecr=703394224"
"262","0.079869977","127.0.0.1","127.0.0.1","TCP","450","5001  >  38492 [PSH, ACK] Seq=49921 Ack=21354 Win=3083 Len=384 TSval=703394248 TSecr=703394248"
"263","0.079910382","127.0.0.1","127.0.0.1","TCP","229","38492  >  5001 [PSH, ACK] Seq=21354 Ack=50305 Win=6146 Len=163 TSval=703394248 TSecr=703394248"
