,No.,Time,Source,Destination,Protocol,Length,Info,Outcome
0,1,0.0,127.0.0.1,127.0.0.1,TCP,229,"38492  >  5001 [PSH, ACK] Seq=1 Ack=1 Win=6146 Len=163 TSval=703394168 TSecr=703394140",yes
1,2,0.00011807799999999999,127.0.0.1,127.0.0.1,TCP,450,"5001  >  38492 [PSH, ACK] Seq=1 Ack=164 Win=3083 Len=384 TSval=703394168 TSecr=703394168",yes
2,3,0.00017251299999999998,127.0.0.1,127.0.0.1,TCP,229,"38492  >  5001 [PSH, ACK] Seq=164 Ack=385 Win=6146 Len=163 TSval=703394168 TSecr=703394168",yes
3,4,0.00020838400000000002,127.0.0.1,127.0.0.1,TCP,450,"5001  >  38492 [PSH, ACK] Seq=385 Ack=327 Win=3083 Len=384 TSval=703394168 TSecr=703394168",yes
4,5,0.00025963099999999997,127.0.0.1,127.0.0.1,TCP,229,"38492  >  5001 [PSH, ACK] Seq=327 Ack=769 Win=6146 Len=163 TSval=703394168 TSecr=703394168",yes
5,6,0.000290884,127.0.0.1,127.0.0.1,TCP,450,"5001  >  38492 [PSH, ACK] Seq=769 Ack=490 Win=3083 Len=384 TSval=703394168 TSecr=703394168",yes
6,7,0.000315436,127.0.0.1,127.0.0.1,TCP,229,"38492  >  5001 [PSH, ACK] Seq=490 Ack=1153 Win=6146 Len=163 TSval=703394169 TSecr=703394168",yes
7,8,0.00034125599999999996,127.0.0.1,127.0.0.1,TCP,450,"5001  >  38492 [PSH, ACK] Seq=1153 Ack=653 Win=3083 Len=384 TSval=703394169 TSecr=703394169",yes
8,9,0.000366286,127.0.0.1,127.0.0.1,TCP,229,"38492  >  5001 [PSH, ACK] Seq=653 Ack=1537 Win=6146 Len=163 TSval=703394169 TSecr=703394169",yes
9,10,0.000394172,127.0.0.1,127.0.0.1,TCP,450,"5001  >  38492 [PSH, ACK] Seq=1537 Ack=816 Win=3083 Len=384 TSval=703394169 TSecr=703394169",yes
10,11,0.00041823,127.0.0.1,127.0.0.1,TCP,229,"38492  >  5001 [PSH, ACK] Seq=816 Ack=1921 Win=6146 Len=163 TSval=703394169 TSecr=703394169",yes
11,12,0.000446999,127.0.0.1,127.0.0.1,TCP,450,"5001  >  38492 [PSH, ACK] Seq=1921 Ack=979 Win=3083 Len=384 TSval=703394169 TSecr=703394169",yes
12,13,0.000477453,127.0.0.1,127.0.0.1,TCP,229,"38492  >  5001 [PSH, ACK] Seq=979 Ack=2305 Win=6146 Len=163 TSval=703394169 TSecr=703394169",yes
13,14,0.0005075230000000001,127.0.0.1,127.0.0.1,TCP,450,"5001  >  38492 [PSH, ACK] Seq=2305 Ack=1142 Win=3083 Len=384 TSval=703394169 TSecr=703394169",yes
14,15,0.000539145,127.0.0.1,127.0.0.1,TCP,229,"38492  >  5001 [PSH, ACK] Seq=1142 Ack=2689 Win=6146 Len=163 TSval=703394169 TSecr=703394169",yes
15,16,0.000567689,127.0.0.1,127.0.0.1,TCP,450,"5001  >  38492 [PSH, ACK] Seq=2689 Ack=1305 Win=3083 Len=384 TSval=703394169 TSecr=703394169",yes
16,17,0.000594216,127.0.0.1,127.0.0.1,TCP,229,"38492  >  5001 [PSH, ACK] Seq=1305 Ack=3073 Win=6146 Len=163 TSval=703394169 TSecr=703394169",yes
17,18,0.000621034,127.0.0.1,127.0.0.1,TCP,450,"5001  >  38492 [PSH, ACK] Seq=3073 Ack=1468 Win=3083 Len=384 TSval=703394169 TSecr=703394169",yes
18,19,0.000648622,127.0.0.1,127.0.0.1,TCP,229,"38492  >  5001 [PSH, ACK] Seq=1468 Ack=3457 Win=6146 Len=163 TSval=703394169 TSecr=703394169",yes
19,20,0.0006740380000000001,127.0.0.1,127.0.0.1,TCP,450,"5001  >  38492 [PSH, ACK] Seq=3457 Ack=1631 Win=3083 Len=384 TSval=703394169 TSecr=703394169",yes
20,21,0.000699285,127.0.0.1,127.0.0.1,TCP,229,"38492  >  5001 [PSH, ACK] Seq=1631 Ack=3841 Win=6146 Len=163 TSval=703394169 TSecr=703394169",yes
21,22,0.0007249110000000001,127.0.0.1,127.0.0.1,TCP,450,"5001  >  38492 [PSH, ACK] Seq=3841 Ack=1794 Win=3083 Len=384 TSval=703394169 TSecr=703394169",yes
22,23,0.000751704,127.0.0.1,127.0.0.1,TCP,229,"38492  >  5001 [PSH, ACK] Seq=1794 Ack=4225 Win=6146 Len=163 TSval=703394169 TSecr=703394169",yes
23,24,0.000778968,127.0.0.1,127.0.0.1,TCP,450,"5001  >  38492 [PSH, ACK] Seq=4225 Ack=1957 Win=3083 Len=384 TSval=703394169 TSecr=703394169",yes
24,25,0.0008079010000000001,127.0.0.1,127.0.0.1,TCP,229,"38492  >  5001 [PSH, ACK] Seq=1957 Ack=4609 Win=6146 Len=163 TSval=703394169 TSecr=703394169",yes
25,26,0.000837361,127.0.0.1,127.0.0.1,TCP,450,"5001  >  38492 [PSH, ACK] Seq=4609 Ack=2120 Win=3083 Len=384 TSval=703394169 TSecr=703394169",yes
26,27,0.000861624,127.0.0.1,127.0.0.1,TCP,229,"38492  >  5001 [PSH, ACK] Seq=2120 Ack=4993 Win=6146 Len=163 TSval=703394169 TSecr=703394169",yes
27,28,0.000891705,127.0.0.1,127.0.0.1,TCP,450,"5001  >  38492 [PSH, ACK] Seq=4993 Ack=2283 Win=3083 Len=384 TSval=703394169 TSecr=703394169",yes
28,29,0.000922858,127.0.0.1,127.0.0.1,TCP,229,"38492  >  5001 [PSH, ACK] Seq=2283 Ack=5377 Win=6146 Len=163 TSval=703394169 TSecr=703394169",yes
29,30,0.000962281,127.0.0.1,127.0.0.1,TCP,450,"5001  >  38492 [PSH, ACK] Seq=5377 Ack=2446 Win=3083 Len=384 TSval=703394169 TSecr=703394169",yes
30,31,0.001001745,127.0.0.1,127.0.0.1,TCP,229,"38492  >  5001 [PSH, ACK] Seq=2446 Ack=5761 Win=6146 Len=163 TSval=703394169 TSecr=703394169",yes
31,32,0.001039368,127.0.0.1,127.0.0.1,TCP,450,"5001  >  38492 [PSH, ACK] Seq=5761 Ack=2609 Win=3083 Len=384 TSval=703394169 TSecr=703394169",yes
32,33,0.001082111,127.0.0.1,127.0.0.1,TCP,229,"38492  >  5001 [PSH, ACK] Seq=2609 Ack=6145 Win=6146 Len=163 TSval=703394169 TSecr=703394169",yes
33,34,0.0011249510000000001,127.0.0.1,127.0.0.1,TCP,450,"5001  >  38492 [PSH, ACK] Seq=6145 Ack=2772 Win=3083 Len=384 TSval=703394169 TSecr=703394169",yes
34,35,0.001160985,127.0.0.1,127.0.0.1,TCP,229,"38492  >  5001 [PSH, ACK] Seq=2772 Ack=6529 Win=6146 Len=163 TSval=703394169 TSecr=703394169",yes
35,36,0.001197436,127.0.0.1,127.0.0.1,TCP,450,"5001  >  38492 [PSH, ACK] Seq=6529 Ack=2935 Win=3083 Len=384 TSval=703394169 TSecr=703394169",yes
36,37,0.00123381,127.0.0.1,127.0.0.1,TCP,229,"38492  >  5001 [PSH, ACK] Seq=2935 Ack=6913 Win=6146 Len=163 TSval=703394169 TSecr=703394169",yes
37,38,0.001272027,127.0.0.1,127.0.0.1,TCP,450,"5001  >  38492 [PSH, ACK] Seq=6913 Ack=3098 Win=3083 Len=384 TSval=703394169 TSecr=703394169",yes
38,39,0.001313315,127.0.0.1,127.0.0.1,TCP,229,"38492  >  5001 [PSH, ACK] Seq=3098 Ack=7297 Win=6146 Len=163 TSval=703394170 TSecr=703394169",yes
39,40,0.001338406,127.0.0.1,127.0.0.1,TCP,450,"5001  >  38492 [PSH, ACK] Seq=7297 Ack=3261 Win=3083 Len=384 TSval=703394170 TSecr=703394170",yes
40,41,0.001361866,127.0.0.1,127.0.0.1,TCP,229,"38492  >  5001 [PSH, ACK] Seq=3261 Ack=7681 Win=6146 Len=163 TSval=703394170 TSecr=703394170",yes
41,42,0.001390011,127.0.0.1,127.0.0.1,TCP,450,"5001  >  38492 [PSH, ACK] Seq=7681 Ack=3424 Win=3083 Len=384 TSval=703394170 TSecr=703394170",yes
42,43,0.001417141,127.0.0.1,127.0.0.1,TCP,229,"38492  >  5001 [PSH, ACK] Seq=3424 Ack=8065 Win=6146 Len=163 TSval=703394170 TSecr=703394170",yes
43,44,0.0014444310000000001,127.0.0.1,127.0.0.1,TCP,450,"5001  >  38492 [PSH, ACK] Seq=8065 Ack=3587 Win=3083 Len=384 TSval=703394170 TSecr=703394170",yes
44,45,0.001545141,127.0.0.1,127.0.0.1,TCP,229,"38492  >  5001 [PSH, ACK] Seq=3587 Ack=8449 Win=6146 Len=163 TSval=703394170 TSecr=703394170",yes
45,46,0.0016234379999999998,127.0.0.1,127.0.0.1,TCP,450,"5001  >  38492 [PSH, ACK] Seq=8449 Ack=3750 Win=3083 Len=384 TSval=703394170 TSecr=703394170",yes
46,47,0.001669736,127.0.0.1,127.0.0.1,TCP,229,"38492  >  5001 [PSH, ACK] Seq=3750 Ack=8833 Win=6146 Len=163 TSval=703394170 TSecr=703394170",yes
47,48,0.0017073129999999998,127.0.0.1,127.0.0.1,TCP,450,"5001  >  38492 [PSH, ACK] Seq=8833 Ack=3913 Win=3083 Len=384 TSval=703394170 TSecr=703394170",yes
48,49,0.001765554,127.0.0.1,127.0.0.1,TCP,229,"38492  >  5001 [PSH, ACK] Seq=3913 Ack=9217 Win=6146 Len=163 TSval=703394170 TSecr=703394170",yes
49,50,0.001816729,127.0.0.1,127.0.0.1,TCP,450,"5001  >  38492 [PSH, ACK] Seq=9217 Ack=4076 Win=3083 Len=384 TSval=703394170 TSecr=703394170",yes
50,51,0.0019140370000000002,127.0.0.1,127.0.0.1,TCP,229,"38492  >  5001 [PSH, ACK] Seq=4076 Ack=9601 Win=6146 Len=163 TSval=703394170 TSecr=703394170",yes
51,52,0.002037376,127.0.0.1,127.0.0.1,TCP,450,"5001  >  38492 [PSH, ACK] Seq=9601 Ack=4239 Win=3083 Len=384 TSval=703394170 TSecr=703394170",yes
52,53,0.002102052,127.0.0.1,127.0.0.1,TCP,229,"38492  >  5001 [PSH, ACK] Seq=4239 Ack=9985 Win=6146 Len=163 TSval=703394170 TSecr=703394170",yes
53,54,0.0021432120000000002,127.0.0.1,127.0.0.1,TCP,450,"5001  >  38492 [PSH, ACK] Seq=9985 Ack=4402 Win=3083 Len=384 TSval=703394170 TSecr=703394170",yes
54,55,0.002174821,127.0.0.1,127.0.0.1,TCP,229,"38492  >  5001 [PSH, ACK] Seq=4402 Ack=10369 Win=6146 Len=163 TSval=703394170 TSecr=703394170",yes
55,56,0.002237422,127.0.0.1,127.0.0.1,TCP,450,"5001  >  38492 [PSH, ACK] Seq=10369 Ack=4565 Win=3083 Len=384 TSval=703394170 TSecr=703394170",yes
56,57,0.0022937820000000003,127.0.0.1,127.0.0.1,TCP,229,"38492  >  5001 [PSH, ACK] Seq=4565 Ack=10753 Win=6146 Len=163 TSval=703394170 TSecr=703394170",yes
57,58,0.002334767,127.0.0.1,127.0.0.1,TCP,450,"5001  >  38492 [PSH, ACK] Seq=10753 Ack=4728 Win=3083 Len=384 TSval=703394171 TSecr=703394170",yes
58,59,0.00236826,127.0.0.1,127.0.0.1,TCP,229,"38492  >  5001 [PSH, ACK] Seq=4728 Ack=11137 Win=6146 Len=163 TSval=703394171 TSecr=703394171",yes
59,60,0.002400136,127.0.0.1,127.0.0.1,TCP,450,"5001  >  38492 [PSH, ACK] Seq=11137 Ack=4891 Win=3083 Len=384 TSval=703394171 TSecr=703394171",yes
60,61,0.002474276,127.0.0.1,127.0.0.1,TCP,229,"38492  >  5001 [PSH, ACK] Seq=4891 Ack=11521 Win=6146 Len=163 TSval=703394171 TSecr=703394171",yes
61,62,0.0025075089999999998,127.0.0.1,127.0.0.1,TCP,450,"5001  >  38492 [PSH, ACK] Seq=11521 Ack=5054 Win=3083 Len=384 TSval=703394171 TSecr=703394171",yes
62,63,0.002564841,127.0.0.1,127.0.0.1,TCP,229,"38492  >  5001 [PSH, ACK] Seq=5054 Ack=11905 Win=6146 Len=163 TSval=703394171 TSecr=703394171",yes
63,64,0.002638824,127.0.0.1,127.0.0.1,TCP,450,"5001  >  38492 [PSH, ACK] Seq=11905 Ack=5217 Win=3083 Len=384 TSval=703394171 TSecr=703394171",yes
64,65,0.03140248,127.0.0.1,127.0.0.1,TCP,229,"38492  >  5001 [PSH, ACK] Seq=5217 Ack=12289 Win=6146 Len=163 TSval=703394200 TSecr=703394171",yes
65,66,0.031493188,127.0.0.1,127.0.0.1,TCP,450,"5001  >  38492 [PSH, ACK] Seq=12289 Ack=5380 Win=3083 Len=384 TSval=703394200 TSecr=703394200",yes
66,67,0.031548884,127.0.0.1,127.0.0.1,TCP,229,"38492  >  5001 [PSH, ACK] Seq=5380 Ack=12673 Win=6146 Len=163 TSval=703394200 TSecr=703394200",yes
67,68,0.031588023,127.0.0.1,127.0.0.1,TCP,450,"5001  >  38492 [PSH, ACK] Seq=12673 Ack=5543 Win=3083 Len=384 TSval=703394200 TSecr=703394200",yes
68,69,0.03163878,127.0.0.1,127.0.0.1,TCP,229,"38492  >  5001 [PSH, ACK] Seq=5543 Ack=13057 Win=6146 Len=163 TSval=703394200 TSecr=703394200",yes
69,70,0.031672157,127.0.0.1,127.0.0.1,TCP,450,"5001  >  38492 [PSH, ACK] Seq=13057 Ack=5706 Win=3083 Len=384 TSval=703394200 TSecr=703394200",yes
70,71,0.031704573,127.0.0.1,127.0.0.1,TCP,229,"38492  >  5001 [PSH, ACK] Seq=5706 Ack=13441 Win=6146 Len=163 TSval=703394200 TSecr=703394200",yes
71,72,0.031734923,127.0.0.1,127.0.0.1,TCP,450,"5001  >  38492 [PSH, ACK] Seq=13441 Ack=5869 Win=3083 Len=384 TSval=703394200 TSecr=703394200",yes
72,73,0.031760749,127.0.0.1,127.0.0.1,TCP,229,"38492  >  5001 [PSH, ACK] Seq=5869 Ack=13825 Win=6146 Len=163 TSval=703394200 TSecr=703394200",yes
73,74,0.031786159,127.0.0.1,127.0.0.1,TCP,450,"5001  >  38492 [PSH, ACK] Seq=13825 Ack=6032 Win=3083 Len=384 TSval=703394200 TSecr=703394200",yes
74,75,0.031810943,127.0.0.1,127.0.0.1,TCP,229,"38492  >  5001 [PSH, ACK] Seq=6032 Ack=14209 Win=6146 Len=163 TSval=703394200 TSecr=703394200",yes
75,76,0.031837508,127.0.0.1,127.0.0.1,TCP,450,"5001  >  38492 [PSH, ACK] Seq=14209 Ack=6195 Win=3083 Len=384 TSval=703394200 TSecr=703394200",yes
76,77,0.031874467999999996,127.0.0.1,127.0.0.1,TCP,229,"38492  >  5001 [PSH, ACK] Seq=6195 Ack=14593 Win=6146 Len=163 TSval=703394200 TSecr=703394200",yes
77,78,0.031906795,127.0.0.1,127.0.0.1,TCP,450,"5001  >  38492 [PSH, ACK] Seq=14593 Ack=6358 Win=3083 Len=384 TSval=703394200 TSecr=703394200",yes
78,79,0.031936333,127.0.0.1,127.0.0.1,TCP,229,"38492  >  5001 [PSH, ACK] Seq=6358 Ack=14977 Win=6146 Len=163 TSval=703394200 TSecr=703394200",yes
79,80,0.031965504,127.0.0.1,127.0.0.1,TCP,450,"5001  >  38492 [PSH, ACK] Seq=14977 Ack=6521 Win=3083 Len=384 TSval=703394200 TSecr=703394200",yes
80,81,0.031991904,127.0.0.1,127.0.0.1,TCP,229,"38492  >  5001 [PSH, ACK] Seq=6521 Ack=15361 Win=6146 Len=163 TSval=703394200 TSecr=703394200",yes
81,82,0.032013972,127.0.0.1,127.0.0.1,TCP,450,"5001  >  38492 [PSH, ACK] Seq=15361 Ack=6684 Win=3083 Len=384 TSval=703394200 TSecr=703394200",yes
82,83,0.032040297,127.0.0.1,127.0.0.1,TCP,229,"38492  >  5001 [PSH, ACK] Seq=6684 Ack=15745 Win=6146 Len=163 TSval=703394200 TSecr=703394200",yes
83,84,0.032057802,127.0.0.1,127.0.0.1,TCP,450,"5001  >  38492 [PSH, ACK] Seq=15745 Ack=6847 Win=3083 Len=384 TSval=703394200 TSecr=703394200",yes
84,85,0.032081989,127.0.0.1,127.0.0.1,TCP,229,"38492  >  5001 [PSH, ACK] Seq=6847 Ack=16129 Win=6146 Len=163 TSval=703394200 TSecr=703394200",yes
85,86,0.032101608,127.0.0.1,127.0.0.1,TCP,450,"5001  >  38492 [PSH, ACK] Seq=16129 Ack=7010 Win=3083 Len=384 TSval=703394200 TSecr=703394200",yes
86,87,0.03212413,127.0.0.1,127.0.0.1,TCP,229,"38492  >  5001 [PSH, ACK] Seq=7010 Ack=16513 Win=6146 Len=163 TSval=703394200 TSecr=703394200",yes
87,88,0.032142777000000004,127.0.0.1,127.0.0.1,TCP,450,"5001  >  38492 [PSH, ACK] Seq=16513 Ack=7173 Win=3083 Len=384 TSval=703394200 TSecr=703394200",yes
88,89,0.032164695,127.0.0.1,127.0.0.1,TCP,229,"38492  >  5001 [PSH, ACK] Seq=7173 Ack=16897 Win=6146 Len=163 TSval=703394200 TSecr=703394200",yes
89,90,0.032184408,127.0.0.1,127.0.0.1,TCP,450,"5001  >  38492 [PSH, ACK] Seq=16897 Ack=7336 Win=3083 Len=384 TSval=703394200 TSecr=703394200",yes
90,91,0.032211803,127.0.0.1,127.0.0.1,TCP,229,"38492  >  5001 [PSH, ACK] Seq=7336 Ack=17281 Win=6146 Len=163 TSval=703394200 TSecr=703394200",yes
91,92,0.032259996,127.0.0.1,127.0.0.1,TCP,450,"5001  >  38492 [PSH, ACK] Seq=17281 Ack=7499 Win=3083 Len=384 TSval=703394200 TSecr=703394200",yes
92,93,0.032295915,127.0.0.1,127.0.0.1,TCP,229,"38492  >  5001 [PSH, ACK] Seq=7499 Ack=17665 Win=6146 Len=163 TSval=703394201 TSecr=703394200",yes
93,94,0.032355141000000004,127.0.0.1,127.0.0.1,TCP,450,"5001  >  38492 [PSH, ACK] Seq=17665 Ack=7662 Win=3083 Len=384 TSval=703394201 TSecr=703394201",yes
94,95,0.032383665,127.0.0.1,127.0.0.1,TCP,229,"38492  >  5001 [PSH, ACK] Seq=7662 Ack=18049 Win=6146 Len=163 TSval=703394201 TSecr=703394201",yes
95,96,0.032422658,127.0.0.1,127.0.0.1,TCP,450,"5001  >  38492 [PSH, ACK] Seq=18049 Ack=7825 Win=3083 Len=384 TSval=703394201 TSecr=703394201",yes
96,97,0.032449368,127.0.0.1,127.0.0.1,TCP,229,"38492  >  5001 [PSH, ACK] Seq=7825 Ack=18433 Win=6146 Len=163 TSval=703394201 TSecr=703394201",yes
97,98,0.032473951,127.0.0.1,127.0.0.1,TCP,450,"5001  >  38492 [PSH, ACK] Seq=18433 Ack=7988 Win=3083 Len=384 TSval=703394201 TSecr=703394201",yes
98,99,0.032499812,127.0.0.1,127.0.0.1,TCP,229,"38492  >  5001 [PSH, ACK] Seq=7988 Ack=18817 Win=6146 Len=163 TSval=703394201 TSecr=703394201",yes
99,100,0.032524147999999996,127.0.0.1,127.0.0.1,TCP,450,"5001  >  38492 [PSH, ACK] Seq=18817 Ack=8151 Win=3083 Len=384 TSval=703394201 TSecr=703394201",yes
100,101,0.032553397000000005,127.0.0.1,127.0.0.1,TCP,229,"38492  >  5001 [PSH, ACK] Seq=8151 Ack=19201 Win=6146 Len=163 TSval=703394201 TSecr=703394201",yes
101,102,0.032582152999999996,127.0.0.1,127.0.0.1,TCP,450,"5001  >  38492 [PSH, ACK] Seq=19201 Ack=8314 Win=3083 Len=384 TSval=703394201 TSecr=703394201",yes
102,103,0.032609065,127.0.0.1,127.0.0.1,TCP,229,"38492  >  5001 [PSH, ACK] Seq=8314 Ack=19585 Win=6146 Len=163 TSval=703394201 TSecr=703394201",yes
103,104,0.032638284,127.0.0.1,127.0.0.1,TCP,450,"5001  >  38492 [PSH, ACK] Seq=19585 Ack=8477 Win=3083 Len=384 TSval=703394201 TSecr=703394201",yes
104,105,0.033094542000000005,127.0.0.1,127.0.0.1,TCP,229,"38492  >  5001 [PSH, ACK] Seq=8477 Ack=19969 Win=6146 Len=163 TSval=703394201 TSecr=703394201",yes
105,106,0.033157845,127.0.0.1,127.0.0.1,TCP,450,"5001  >  38492 [PSH, ACK] Seq=19969 Ack=8640 Win=3083 Len=384 TSval=703394201 TSecr=703394201",yes
106,107,0.033188245,127.0.0.1,127.0.0.1,TCP,229,"38492  >  5001 [PSH, ACK] Seq=8640 Ack=20353 Win=6146 Len=163 TSval=703394201 TSecr=703394201",yes
107,108,0.033219157,127.0.0.1,127.0.0.1,TCP,450,"5001  >  38492 [PSH, ACK] Seq=20353 Ack=8803 Win=3083 Len=384 TSval=703394201 TSecr=703394201",yes
108,109,0.033250164,127.0.0.1,127.0.0.1,TCP,229,"38492  >  5001 [PSH, ACK] Seq=8803 Ack=20737 Win=6146 Len=163 TSval=703394201 TSecr=703394201",yes
109,110,0.033287672000000004,127.0.0.1,127.0.0.1,TCP,450,"5001  >  38492 [PSH, ACK] Seq=20737 Ack=8966 Win=3083 Len=384 TSval=703394202 TSecr=703394201",yes
110,111,0.033319422,127.0.0.1,127.0.0.1,TCP,229,"38492  >  5001 [PSH, ACK] Seq=8966 Ack=21121 Win=6146 Len=163 TSval=703394202 TSecr=703394202",yes
111,112,0.033356512000000005,127.0.0.1,127.0.0.1,TCP,450,"5001  >  38492 [PSH, ACK] Seq=21121 Ack=9129 Win=3083 Len=384 TSval=703394202 TSecr=703394202",yes
112,113,0.033392839,127.0.0.1,127.0.0.1,TCP,229,"38492  >  5001 [PSH, ACK] Seq=9129 Ack=21505 Win=6146 Len=163 TSval=703394202 TSecr=703394202",yes
113,114,0.033424199,127.0.0.1,127.0.0.1,TCP,450,"5001  >  38492 [PSH, ACK] Seq=21505 Ack=9292 Win=3083 Len=384 TSval=703394202 TSecr=703394202",yes
114,115,0.033450267,127.0.0.1,127.0.0.1,TCP,229,"38492  >  5001 [PSH, ACK] Seq=9292 Ack=21889 Win=6146 Len=163 TSval=703394202 TSecr=703394202",yes
115,116,0.033477184,127.0.0.1,127.0.0.1,TCP,450,"5001  >  38492 [PSH, ACK] Seq=21889 Ack=9455 Win=3083 Len=384 TSval=703394202 TSecr=703394202",yes
116,117,0.033501647999999995,127.0.0.1,127.0.0.1,TCP,229,"38492  >  5001 [PSH, ACK] Seq=9455 Ack=22273 Win=6146 Len=163 TSval=703394202 TSecr=703394202",yes
117,118,0.033529456,127.0.0.1,127.0.0.1,TCP,450,"5001  >  38492 [PSH, ACK] Seq=22273 Ack=9618 Win=3083 Len=384 TSval=703394202 TSecr=703394202",yes
118,119,0.033554044,127.0.0.1,127.0.0.1,TCP,229,"38492  >  5001 [PSH, ACK] Seq=9618 Ack=22657 Win=6146 Len=163 TSval=703394202 TSecr=703394202",yes
119,120,0.033580136000000003,127.0.0.1,127.0.0.1,TCP,450,"5001  >  38492 [PSH, ACK] Seq=22657 Ack=9781 Win=3083 Len=384 TSval=703394202 TSecr=703394202",yes
120,121,0.033602681,127.0.0.1,127.0.0.1,TCP,229,"38492  >  5001 [PSH, ACK] Seq=9781 Ack=23041 Win=6146 Len=163 TSval=703394202 TSecr=703394202",yes
121,122,0.033627549,127.0.0.1,127.0.0.1,TCP,450,"5001  >  38492 [PSH, ACK] Seq=23041 Ack=9944 Win=3083 Len=384 TSval=703394202 TSecr=703394202",yes
122,123,0.033648467,127.0.0.1,127.0.0.1,TCP,229,"38492  >  5001 [PSH, ACK] Seq=9944 Ack=23425 Win=6146 Len=163 TSval=703394202 TSecr=703394202",yes
123,124,0.033673321,127.0.0.1,127.0.0.1,TCP,450,"5001  >  38492 [PSH, ACK] Seq=23425 Ack=10107 Win=3083 Len=384 TSval=703394202 TSecr=703394202",yes
124,125,0.033696767,127.0.0.1,127.0.0.1,TCP,229,"38492  >  5001 [PSH, ACK] Seq=10107 Ack=23809 Win=6146 Len=163 TSval=703394202 TSecr=703394202",yes
125,126,0.033726451,127.0.0.1,127.0.0.1,TCP,450,"5001  >  38492 [PSH, ACK] Seq=23809 Ack=10270 Win=3083 Len=384 TSval=703394202 TSecr=703394202",yes
126,127,0.03374804,127.0.0.1,127.0.0.1,TCP,229,"38492  >  5001 [PSH, ACK] Seq=10270 Ack=24193 Win=6146 Len=163 TSval=703394202 TSecr=703394202",yes
127,128,0.033775155,127.0.0.1,127.0.0.1,TCP,450,"5001  >  38492 [PSH, ACK] Seq=24193 Ack=10433 Win=3083 Len=384 TSval=703394202 TSecr=703394202",yes
128,129,0.033800797,127.0.0.1,127.0.0.1,TCP,229,"38492  >  5001 [PSH, ACK] Seq=10433 Ack=24577 Win=6146 Len=163 TSval=703394202 TSecr=703394202",yes
129,130,0.033828328,127.0.0.1,127.0.0.1,TCP,450,"5001  >  38492 [PSH, ACK] Seq=24577 Ack=10596 Win=3083 Len=384 TSval=703394202 TSecr=703394202",yes
130,131,0.033855835,127.0.0.1,127.0.0.1,TCP,229,"38492  >  5001 [PSH, ACK] Seq=10596 Ack=24961 Win=6146 Len=163 TSval=703394202 TSecr=703394202",yes
131,132,0.033890795,127.0.0.1,127.0.0.1,TCP,450,"5001  >  38492 [PSH, ACK] Seq=24961 Ack=10759 Win=3083 Len=384 TSval=703394202 TSecr=703394202",yes
132,133,0.033923615,127.0.0.1,127.0.0.1,TCP,229,"38492  >  5001 [PSH, ACK] Seq=10759 Ack=25345 Win=6146 Len=163 TSval=703394202 TSecr=703394202",yes
133,134,0.033957266,127.0.0.1,127.0.0.1,TCP,450,"5001  >  38492 [PSH, ACK] Seq=25345 Ack=10922 Win=3083 Len=384 TSval=703394202 TSecr=703394202",yes
134,135,0.033991894,127.0.0.1,127.0.0.1,TCP,229,"38492  >  5001 [PSH, ACK] Seq=10922 Ack=25729 Win=6146 Len=163 TSval=703394202 TSecr=703394202",yes
135,136,0.034027468,127.0.0.1,127.0.0.1,TCP,450,"5001  >  38492 [PSH, ACK] Seq=25729 Ack=11085 Win=3083 Len=384 TSval=703394202 TSecr=703394202",yes
136,137,0.034058982,127.0.0.1,127.0.0.1,TCP,229,"38492  >  5001 [PSH, ACK] Seq=11085 Ack=26113 Win=6146 Len=163 TSval=703394202 TSecr=703394202",yes
137,138,0.034087341,127.0.0.1,127.0.0.1,TCP,450,"5001  >  38492 [PSH, ACK] Seq=26113 Ack=11248 Win=3083 Len=384 TSval=703394202 TSecr=703394202",yes
138,139,0.03411667,127.0.0.1,127.0.0.1,TCP,229,"38492  >  5001 [PSH, ACK] Seq=11248 Ack=26497 Win=6146 Len=163 TSval=703394202 TSecr=703394202",yes
139,140,0.034152233,127.0.0.1,127.0.0.1,TCP,450,"5001  >  38492 [PSH, ACK] Seq=26497 Ack=11411 Win=3083 Len=384 TSval=703394202 TSecr=703394202",yes
140,141,0.034174819,127.0.0.1,127.0.0.1,TCP,229,"38492  >  5001 [PSH, ACK] Seq=11411 Ack=26881 Win=6146 Len=163 TSval=703394202 TSecr=703394202",yes
141,142,0.034202377,127.0.0.1,127.0.0.1,TCP,450,"5001  >  38492 [PSH, ACK] Seq=26881 Ack=11574 Win=3083 Len=384 TSval=703394202 TSecr=703394202",yes
142,143,0.034221572,127.0.0.1,127.0.0.1,TCP,229,"38492  >  5001 [PSH, ACK] Seq=11574 Ack=27265 Win=6146 Len=163 TSval=703394202 TSecr=703394202",yes
143,144,0.034248048999999996,127.0.0.1,127.0.0.1,TCP,450,"5001  >  38492 [PSH, ACK] Seq=27265 Ack=11737 Win=3083 Len=384 TSval=703394202 TSecr=703394202",yes
144,145,0.034268777,127.0.0.1,127.0.0.1,TCP,229,"38492  >  5001 [PSH, ACK] Seq=11737 Ack=27649 Win=6146 Len=163 TSval=703394202 TSecr=703394202",yes
145,146,0.034294546,127.0.0.1,127.0.0.1,TCP,450,"5001  >  38492 [PSH, ACK] Seq=27649 Ack=11900 Win=3083 Len=384 TSval=703394203 TSecr=703394202",yes
146,147,0.034314897999999996,127.0.0.1,127.0.0.1,TCP,229,"38492  >  5001 [PSH, ACK] Seq=11900 Ack=28033 Win=6146 Len=163 TSval=703394203 TSecr=703394203",yes
147,148,0.034338723,127.0.0.1,127.0.0.1,TCP,450,"5001  >  38492 [PSH, ACK] Seq=28033 Ack=12063 Win=3083 Len=384 TSval=703394203 TSecr=703394203",yes
148,149,0.034358977,127.0.0.1,127.0.0.1,TCP,229,"38492  >  5001 [PSH, ACK] Seq=12063 Ack=28417 Win=6146 Len=163 TSval=703394203 TSecr=703394203",yes
149,150,0.034393427000000004,127.0.0.1,127.0.0.1,TCP,450,"5001  >  38492 [PSH, ACK] Seq=28417 Ack=12226 Win=3083 Len=384 TSval=703394203 TSecr=703394203",yes
150,151,0.034435129,127.0.0.1,127.0.0.1,TCP,229,"38492  >  5001 [PSH, ACK] Seq=12226 Ack=28801 Win=6146 Len=163 TSval=703394203 TSecr=703394203",yes
151,152,0.034484302,127.0.0.1,127.0.0.1,TCP,450,"5001  >  38492 [PSH, ACK] Seq=28801 Ack=12389 Win=3083 Len=384 TSval=703394203 TSecr=703394203",yes
152,153,0.034527395,127.0.0.1,127.0.0.1,TCP,229,"38492  >  5001 [PSH, ACK] Seq=12389 Ack=29185 Win=6146 Len=163 TSval=703394203 TSecr=703394203",yes
153,154,0.034573106,127.0.0.1,127.0.0.1,TCP,450,"5001  >  38492 [PSH, ACK] Seq=29185 Ack=12552 Win=3083 Len=384 TSval=703394203 TSecr=703394203",yes
154,155,0.034600837,127.0.0.1,127.0.0.1,TCP,229,"38492  >  5001 [PSH, ACK] Seq=12552 Ack=29569 Win=6146 Len=163 TSval=703394203 TSecr=703394203",yes
155,156,0.034618803,127.0.0.1,127.0.0.1,TCP,450,"5001  >  38492 [PSH, ACK] Seq=29569 Ack=12715 Win=3083 Len=384 TSval=703394203 TSecr=703394203",yes
156,157,0.034641089,127.0.0.1,127.0.0.1,TCP,229,"38492  >  5001 [PSH, ACK] Seq=12715 Ack=29953 Win=6146 Len=163 TSval=703394203 TSecr=703394203",yes
157,158,0.034667741,127.0.0.1,127.0.0.1,TCP,450,"5001  >  38492 [PSH, ACK] Seq=29953 Ack=12878 Win=3083 Len=384 TSval=703394203 TSecr=703394203",yes
158,159,0.034694505,127.0.0.1,127.0.0.1,TCP,229,"38492  >  5001 [PSH, ACK] Seq=12878 Ack=30337 Win=6146 Len=163 TSval=703394203 TSecr=703394203",yes
159,160,0.034728302,127.0.0.1,127.0.0.1,TCP,450,"5001  >  38492 [PSH, ACK] Seq=30337 Ack=13041 Win=3083 Len=384 TSval=703394203 TSecr=703394203",yes
160,161,0.034760123,127.0.0.1,127.0.0.1,TCP,229,"38492  >  5001 [PSH, ACK] Seq=13041 Ack=30721 Win=6146 Len=163 TSval=703394203 TSecr=703394203",yes
161,162,0.034790786000000004,127.0.0.1,127.0.0.1,TCP,450,"5001  >  38492 [PSH, ACK] Seq=30721 Ack=13204 Win=3083 Len=384 TSval=703394203 TSecr=703394203",yes
162,163,0.034817924,127.0.0.1,127.0.0.1,TCP,229,"38492  >  5001 [PSH, ACK] Seq=13204 Ack=31105 Win=6146 Len=163 TSval=703394203 TSecr=703394203",yes
163,164,0.034849978999999996,127.0.0.1,127.0.0.1,TCP,450,"5001  >  38492 [PSH, ACK] Seq=31105 Ack=13367 Win=3083 Len=384 TSval=703394203 TSecr=703394203",yes
164,165,0.034890456,127.0.0.1,127.0.0.1,TCP,229,"38492  >  5001 [PSH, ACK] Seq=13367 Ack=31489 Win=6146 Len=163 TSval=703394203 TSecr=703394203",yes
165,166,0.034926015,127.0.0.1,127.0.0.1,TCP,450,"5001  >  38492 [PSH, ACK] Seq=31489 Ack=13530 Win=3083 Len=384 TSval=703394203 TSecr=703394203",yes
166,167,0.034956376000000004,127.0.0.1,127.0.0.1,TCP,229,"38492  >  5001 [PSH, ACK] Seq=13530 Ack=31873 Win=6146 Len=163 TSval=703394203 TSecr=703394203",yes
167,168,0.034988404,127.0.0.1,127.0.0.1,TCP,450,"5001  >  38492 [PSH, ACK] Seq=31873 Ack=13693 Win=3083 Len=384 TSval=703394203 TSecr=703394203",yes
168,169,0.035025744,127.0.0.1,127.0.0.1,TCP,229,"38492  >  5001 [PSH, ACK] Seq=13693 Ack=32257 Win=6146 Len=163 TSval=703394203 TSecr=703394203",yes
169,170,0.035059395,127.0.0.1,127.0.0.1,TCP,450,"5001  >  38492 [PSH, ACK] Seq=32257 Ack=13856 Win=3083 Len=384 TSval=703394203 TSecr=703394203",yes
170,171,0.035108737,127.0.0.1,127.0.0.1,TCP,229,"38492  >  5001 [PSH, ACK] Seq=13856 Ack=32641 Win=6146 Len=163 TSval=703394203 TSecr=703394203",yes
171,172,0.035155647000000005,127.0.0.1,127.0.0.1,TCP,450,"5001  >  38492 [PSH, ACK] Seq=32641 Ack=14019 Win=3083 Len=384 TSval=703394203 TSecr=703394203",yes
172,173,0.035204789,127.0.0.1,127.0.0.1,TCP,229,"38492  >  5001 [PSH, ACK] Seq=14019 Ack=33025 Win=6146 Len=163 TSval=703394203 TSecr=703394203",yes
173,174,0.035240126000000004,127.0.0.1,127.0.0.1,TCP,450,"5001  >  38492 [PSH, ACK] Seq=33025 Ack=14182 Win=3083 Len=384 TSval=703394203 TSecr=703394203",yes
174,175,0.035264158999999996,127.0.0.1,127.0.0.1,TCP,229,"38492  >  5001 [PSH, ACK] Seq=14182 Ack=33409 Win=6146 Len=163 TSval=703394203 TSecr=703394203",yes
175,176,0.035284516,127.0.0.1,127.0.0.1,TCP,450,"5001  >  38492 [PSH, ACK] Seq=33409 Ack=14345 Win=3083 Len=384 TSval=703394204 TSecr=703394203",yes
176,177,0.035301394,127.0.0.1,127.0.0.1,TCP,229,"38492  >  5001 [PSH, ACK] Seq=14345 Ack=33793 Win=6146 Len=163 TSval=703394204 TSecr=703394204",yes
177,178,0.035320682,127.0.0.1,127.0.0.1,TCP,450,"5001  >  38492 [PSH, ACK] Seq=33793 Ack=14508 Win=3083 Len=384 TSval=703394204 TSecr=703394204",yes
178,179,0.035339607,127.0.0.1,127.0.0.1,TCP,229,"38492  >  5001 [PSH, ACK] Seq=14508 Ack=34177 Win=6146 Len=163 TSval=703394204 TSecr=703394204",yes
179,180,0.035358968,127.0.0.1,127.0.0.1,TCP,450,"5001  >  38492 [PSH, ACK] Seq=34177 Ack=14671 Win=3083 Len=384 TSval=703394204 TSecr=703394204",yes
180,181,0.035378022,127.0.0.1,127.0.0.1,TCP,229,"38492  >  5001 [PSH, ACK] Seq=14671 Ack=34561 Win=6146 Len=163 TSval=703394204 TSecr=703394204",yes
181,182,0.035396615,127.0.0.1,127.0.0.1,TCP,450,"5001  >  38492 [PSH, ACK] Seq=34561 Ack=14834 Win=3083 Len=384 TSval=703394204 TSecr=703394204",yes
182,183,0.035415375,127.0.0.1,127.0.0.1,TCP,229,"38492  >  5001 [PSH, ACK] Seq=14834 Ack=34945 Win=6146 Len=163 TSval=703394204 TSecr=703394204",yes
183,184,0.035434154,127.0.0.1,127.0.0.1,TCP,450,"5001  >  38492 [PSH, ACK] Seq=34945 Ack=14997 Win=3083 Len=384 TSval=703394204 TSecr=703394204",yes
184,185,0.03545321,127.0.0.1,127.0.0.1,TCP,229,"38492  >  5001 [PSH, ACK] Seq=14997 Ack=35329 Win=6146 Len=163 TSval=703394204 TSecr=703394204",yes
185,186,0.03547231,127.0.0.1,127.0.0.1,TCP,450,"5001  >  38492 [PSH, ACK] Seq=35329 Ack=15160 Win=3083 Len=384 TSval=703394204 TSecr=703394204",yes
186,187,0.035491207999999996,127.0.0.1,127.0.0.1,TCP,229,"38492  >  5001 [PSH, ACK] Seq=15160 Ack=35713 Win=6146 Len=163 TSval=703394204 TSecr=703394204",yes
187,188,0.035510251,127.0.0.1,127.0.0.1,TCP,450,"5001  >  38492 [PSH, ACK] Seq=35713 Ack=15323 Win=3083 Len=384 TSval=703394204 TSecr=703394204",yes
188,189,0.035529191,127.0.0.1,127.0.0.1,TCP,229,"38492  >  5001 [PSH, ACK] Seq=15323 Ack=36097 Win=6146 Len=163 TSval=703394204 TSecr=703394204",yes
189,190,0.035548401,127.0.0.1,127.0.0.1,TCP,450,"5001  >  38492 [PSH, ACK] Seq=36097 Ack=15486 Win=3083 Len=384 TSval=703394204 TSecr=703394204",yes
190,191,0.035567634,127.0.0.1,127.0.0.1,TCP,229,"38492  >  5001 [PSH, ACK] Seq=15486 Ack=36481 Win=6146 Len=163 TSval=703394204 TSecr=703394204",yes
191,192,0.035587193999999996,127.0.0.1,127.0.0.1,TCP,450,"5001  >  38492 [PSH, ACK] Seq=36481 Ack=15649 Win=3083 Len=384 TSval=703394204 TSecr=703394204",yes
192,193,0.03560633,127.0.0.1,127.0.0.1,TCP,229,"38492  >  5001 [PSH, ACK] Seq=15649 Ack=36865 Win=6146 Len=163 TSval=703394204 TSecr=703394204",yes
193,194,0.035625045,127.0.0.1,127.0.0.1,TCP,450,"5001  >  38492 [PSH, ACK] Seq=36865 Ack=15812 Win=3083 Len=384 TSval=703394204 TSecr=703394204",yes
194,195,0.035643976,127.0.0.1,127.0.0.1,TCP,229,"38492  >  5001 [PSH, ACK] Seq=15812 Ack=37249 Win=6146 Len=163 TSval=703394204 TSecr=703394204",yes
195,196,0.035663345,127.0.0.1,127.0.0.1,TCP,450,"5001  >  38492 [PSH, ACK] Seq=37249 Ack=15975 Win=3083 Len=384 TSval=703394204 TSecr=703394204",yes
196,197,0.035686797,127.0.0.1,127.0.0.1,TCP,229,"38492  >  5001 [PSH, ACK] Seq=15975 Ack=37633 Win=6146 Len=163 TSval=703394204 TSecr=703394204",yes
197,198,0.03570894,127.0.0.1,127.0.0.1,TCP,450,"5001  >  38492 [PSH, ACK] Seq=37633 Ack=16138 Win=3083 Len=384 TSval=703394204 TSecr=703394204",yes
198,199,0.03572862,127.0.0.1,127.0.0.1,TCP,229,"38492  >  5001 [PSH, ACK] Seq=16138 Ack=38017 Win=6146 Len=163 TSval=703394204 TSecr=703394204",yes
199,200,0.035745057999999996,127.0.0.1,127.0.0.1,TCP,450,"5001  >  38492 [PSH, ACK] Seq=38017 Ack=16301 Win=3083 Len=384 TSval=703394204 TSecr=703394204",yes
200,201,0.035763979,127.0.0.1,127.0.0.1,TCP,229,"38492  >  5001 [PSH, ACK] Seq=16301 Ack=38401 Win=6146 Len=163 TSval=703394204 TSecr=703394204",yes
201,202,0.035780114,127.0.0.1,127.0.0.1,TCP,450,"5001  >  38492 [PSH, ACK] Seq=38401 Ack=16464 Win=3083 Len=384 TSval=703394204 TSecr=703394204",yes
202,203,0.035798981,127.0.0.1,127.0.0.1,TCP,229,"38492  >  5001 [PSH, ACK] Seq=16464 Ack=38785 Win=6146 Len=163 TSval=703394204 TSecr=703394204",yes
203,204,0.035815038,127.0.0.1,127.0.0.1,TCP,450,"5001  >  38492 [PSH, ACK] Seq=38785 Ack=16627 Win=3083 Len=384 TSval=703394204 TSecr=703394204",yes
204,205,0.035834158,127.0.0.1,127.0.0.1,TCP,229,"38492  >  5001 [PSH, ACK] Seq=16627 Ack=39169 Win=6146 Len=163 TSval=703394204 TSecr=703394204",yes
205,206,0.035850078,127.0.0.1,127.0.0.1,TCP,450,"5001  >  38492 [PSH, ACK] Seq=39169 Ack=16790 Win=3083 Len=384 TSval=703394204 TSecr=703394204",yes
206,207,0.035868895,127.0.0.1,127.0.0.1,TCP,229,"38492  >  5001 [PSH, ACK] Seq=16790 Ack=39553 Win=6146 Len=163 TSval=703394204 TSecr=703394204",yes
207,208,0.035885042,127.0.0.1,127.0.0.1,TCP,450,"5001  >  38492 [PSH, ACK] Seq=39553 Ack=16953 Win=3083 Len=384 TSval=703394204 TSecr=703394204",yes
208,209,0.035903849,127.0.0.1,127.0.0.1,TCP,229,"38492  >  5001 [PSH, ACK] Seq=16953 Ack=39937 Win=6146 Len=163 TSval=703394204 TSecr=703394204",yes
209,210,0.035919786,127.0.0.1,127.0.0.1,TCP,450,"5001  >  38492 [PSH, ACK] Seq=39937 Ack=17116 Win=3083 Len=384 TSval=703394204 TSecr=703394204",yes
210,211,0.03593852,127.0.0.1,127.0.0.1,TCP,229,"38492  >  5001 [PSH, ACK] Seq=17116 Ack=40321 Win=6146 Len=163 TSval=703394204 TSecr=703394204",yes
211,212,0.03595456,127.0.0.1,127.0.0.1,TCP,450,"5001  >  38492 [PSH, ACK] Seq=40321 Ack=17279 Win=3083 Len=384 TSval=703394204 TSecr=703394204",yes
212,213,0.035973423,127.0.0.1,127.0.0.1,TCP,229,"38492  >  5001 [PSH, ACK] Seq=17279 Ack=40705 Win=6146 Len=163 TSval=703394204 TSecr=703394204",yes
213,214,0.035989512,127.0.0.1,127.0.0.1,TCP,450,"5001  >  38492 [PSH, ACK] Seq=40705 Ack=17442 Win=3083 Len=384 TSval=703394204 TSecr=703394204",yes
214,215,0.036008252000000004,127.0.0.1,127.0.0.1,TCP,229,"38492  >  5001 [PSH, ACK] Seq=17442 Ack=41089 Win=6146 Len=163 TSval=703394204 TSecr=703394204",yes
215,216,0.036033556,127.0.0.1,127.0.0.1,TCP,450,"5001  >  38492 [PSH, ACK] Seq=41089 Ack=17605 Win=3083 Len=384 TSval=703394204 TSecr=703394204",yes
216,217,0.036069738999999996,127.0.0.1,127.0.0.1,TCP,229,"38492  >  5001 [PSH, ACK] Seq=17605 Ack=41473 Win=6146 Len=163 TSval=703394204 TSecr=703394204",yes
217,218,0.036090641,127.0.0.1,127.0.0.1,TCP,450,"5001  >  38492 [PSH, ACK] Seq=41473 Ack=17768 Win=3083 Len=384 TSval=703394204 TSecr=703394204",yes
218,219,0.036143663,127.0.0.1,127.0.0.1,TCP,229,"38492  >  5001 [PSH, ACK] Seq=17768 Ack=41857 Win=6146 Len=163 TSval=703394204 TSecr=703394204",yes
219,220,0.036169199,127.0.0.1,127.0.0.1,TCP,450,"5001  >  38492 [PSH, ACK] Seq=41857 Ack=17931 Win=3083 Len=384 TSval=703394204 TSecr=703394204",yes
220,221,0.038910043,127.0.0.1,127.0.0.1,TCP,229,"38492  >  5001 [PSH, ACK] Seq=17931 Ack=42241 Win=6146 Len=163 TSval=703394207 TSecr=703394204",yes
221,222,0.038972286,127.0.0.1,127.0.0.1,TCP,450,"5001  >  38492 [PSH, ACK] Seq=42241 Ack=18094 Win=3083 Len=384 TSval=703394207 TSecr=703394207",yes
222,223,0.039013894,127.0.0.1,127.0.0.1,TCP,229,"38492  >  5001 [PSH, ACK] Seq=18094 Ack=42625 Win=6146 Len=163 TSval=703394207 TSecr=703394207",yes
223,224,0.039035876000000004,127.0.0.1,127.0.0.1,TCP,450,"5001  >  38492 [PSH, ACK] Seq=42625 Ack=18257 Win=3083 Len=384 TSval=703394207 TSecr=703394207",yes
224,225,0.039079225,127.0.0.1,127.0.0.1,TCP,229,"38492  >  5001 [PSH, ACK] Seq=18257 Ack=43009 Win=6146 Len=163 TSval=703394207 TSecr=703394207",yes
225,226,0.039099373,127.0.0.1,127.0.0.1,TCP,450,"5001  >  38492 [PSH, ACK] Seq=43009 Ack=18420 Win=3083 Len=384 TSval=703394207 TSecr=703394207",yes
226,227,0.039123816,127.0.0.1,127.0.0.1,TCP,229,"38492  >  5001 [PSH, ACK] Seq=18420 Ack=43393 Win=6146 Len=163 TSval=703394207 TSecr=703394207",yes
227,228,0.039143206,127.0.0.1,127.0.0.1,TCP,450,"5001  >  38492 [PSH, ACK] Seq=43393 Ack=18583 Win=3083 Len=384 TSval=703394207 TSecr=703394207",yes
228,229,0.039167066,127.0.0.1,127.0.0.1,TCP,229,"38492  >  5001 [PSH, ACK] Seq=18583 Ack=43777 Win=6146 Len=163 TSval=703394207 TSecr=703394207",yes
229,230,0.039186518999999996,127.0.0.1,127.0.0.1,TCP,450,"5001  >  38492 [PSH, ACK] Seq=43777 Ack=18746 Win=3083 Len=384 TSval=703394207 TSecr=703394207",yes
230,231,0.039210081,127.0.0.1,127.0.0.1,TCP,229,"38492  >  5001 [PSH, ACK] Seq=18746 Ack=44161 Win=6146 Len=163 TSval=703394207 TSecr=703394207",yes
231,232,0.0392295,127.0.0.1,127.0.0.1,TCP,450,"5001  >  38492 [PSH, ACK] Seq=44161 Ack=18909 Win=3083 Len=384 TSval=703394207 TSecr=703394207",yes
232,233,0.039253094,127.0.0.1,127.0.0.1,TCP,229,"38492  >  5001 [PSH, ACK] Seq=18909 Ack=44545 Win=6146 Len=163 TSval=703394207 TSecr=703394207",yes
233,234,0.039272366,127.0.0.1,127.0.0.1,TCP,450,"5001  >  38492 [PSH, ACK] Seq=44545 Ack=19072 Win=3083 Len=384 TSval=703394207 TSecr=703394207",yes
234,235,0.039293335,127.0.0.1,127.0.0.1,TCP,229,"38492  >  5001 [PSH, ACK] Seq=19072 Ack=44929 Win=6146 Len=163 TSval=703394208 TSecr=703394207",yes
235,236,0.039312503,127.0.0.1,127.0.0.1,TCP,450,"5001  >  38492 [PSH, ACK] Seq=44929 Ack=19235 Win=3083 Len=384 TSval=703394208 TSecr=703394208",yes
236,237,0.039333377,127.0.0.1,127.0.0.1,TCP,229,"38492  >  5001 [PSH, ACK] Seq=19235 Ack=45313 Win=6146 Len=163 TSval=703394208 TSecr=703394208",yes
237,238,0.039352763,127.0.0.1,127.0.0.1,TCP,450,"5001  >  38492 [PSH, ACK] Seq=45313 Ack=19398 Win=3083 Len=384 TSval=703394208 TSecr=703394208",yes
238,239,0.039373426,127.0.0.1,127.0.0.1,TCP,229,"38492  >  5001 [PSH, ACK] Seq=19398 Ack=45697 Win=6146 Len=163 TSval=703394208 TSecr=703394208",yes
239,240,0.039392757,127.0.0.1,127.0.0.1,TCP,450,"5001  >  38492 [PSH, ACK] Seq=45697 Ack=19561 Win=3083 Len=384 TSval=703394208 TSecr=703394208",yes
240,241,0.054864183,127.0.0.1,127.0.0.1,TCP,229,"38492  >  5001 [PSH, ACK] Seq=19561 Ack=46081 Win=6146 Len=163 TSval=703394223 TSecr=703394208",yes
241,242,0.055126972,127.0.0.1,127.0.0.1,TCP,450,"5001  >  38492 [PSH, ACK] Seq=46081 Ack=19724 Win=3083 Len=384 TSval=703394223 TSecr=703394223",yes
242,243,0.05527713099999999,127.0.0.1,127.0.0.1,TCP,229,"38492  >  5001 [PSH, ACK] Seq=19724 Ack=46465 Win=6146 Len=163 TSval=703394223 TSecr=703394223",yes
243,244,0.055340877000000004,127.0.0.1,127.0.0.1,TCP,450,"5001  >  38492 [PSH, ACK] Seq=46465 Ack=19887 Win=3083 Len=384 TSval=703394224 TSecr=703394223",yes
244,245,0.055412078,127.0.0.1,127.0.0.1,TCP,229,"38492  >  5001 [PSH, ACK] Seq=19887 Ack=46849 Win=6146 Len=163 TSval=703394224 TSecr=703394224",yes
245,246,0.055449404,127.0.0.1,127.0.0.1,TCP,450,"5001  >  38492 [PSH, ACK] Seq=46849 Ack=20050 Win=3083 Len=384 TSval=703394224 TSecr=703394224",yes
246,247,0.05553487,127.0.0.1,127.0.0.1,TCP,229,"38492  >  5001 [PSH, ACK] Seq=20050 Ack=47233 Win=6146 Len=163 TSval=703394224 TSecr=703394224",yes
247,248,0.055616992000000004,127.0.0.1,127.0.0.1,TCP,450,"5001  >  38492 [PSH, ACK] Seq=47233 Ack=20213 Win=3083 Len=384 TSval=703394224 TSecr=703394224",yes
248,249,0.055719595999999996,127.0.0.1,127.0.0.1,TCP,229,"38492  >  5001 [PSH, ACK] Seq=20213 Ack=47617 Win=6146 Len=163 TSval=703394224 TSecr=703394224",yes
249,250,0.055754767000000004,127.0.0.1,127.0.0.1,TCP,450,"5001  >  38492 [PSH, ACK] Seq=47617 Ack=20376 Win=3083 Len=384 TSval=703394224 TSecr=703394224",yes
250,251,0.055792215,127.0.0.1,127.0.0.1,TCP,229,"38492  >  5001 [PSH, ACK] Seq=20376 Ack=48001 Win=6146 Len=163 TSval=703394224 TSecr=703394224",yes
251,252,0.055834637,127.0.0.1,127.0.0.1,TCP,450,"5001  >  38492 [PSH, ACK] Seq=48001 Ack=20539 Win=3083 Len=384 TSval=703394224 TSecr=703394224",yes
252,253,0.055874042,127.0.0.1,127.0.0.1,TCP,229,"38492  >  5001 [PSH, ACK] Seq=20539 Ack=48385 Win=6146 Len=163 TSval=703394224 TSecr=703394224",yes
253,254,0.055956655,127.0.0.1,127.0.0.1,TCP,450,"5001  >  38492 [PSH, ACK] Seq=48385 Ack=20702 Win=3083 Len=384 TSval=703394224 TSecr=703394224",yes
254,255,0.055998600999999995,127.0.0.1,127.0.0.1,TCP,229,"38492  >  5001 [PSH, ACK] Seq=20702 Ack=48769 Win=6146 Len=163 TSval=703394224 TSecr=703394224",yes
255,256,0.056031749000000006,127.0.0.1,127.0.0.1,TCP,450,"5001  >  38492 [PSH, ACK] Seq=48769 Ack=20865 Win=3083 Len=384 TSval=703394224 TSecr=703394224",yes
256,257,0.056056571,127.0.0.1,127.0.0.1,TCP,229,"38492  >  5001 [PSH, ACK] Seq=20865 Ack=49153 Win=6146 Len=163 TSval=703394224 TSecr=703394224",yes
257,258,0.056084047000000005,127.0.0.1,127.0.0.1,TCP,450,"5001  >  38492 [PSH, ACK] Seq=49153 Ack=21028 Win=3083 Len=384 TSval=703394224 TSecr=703394224",yes
258,259,0.056110069000000005,127.0.0.1,127.0.0.1,TCP,229,"38492  >  5001 [PSH, ACK] Seq=21028 Ack=49537 Win=6146 Len=163 TSval=703394224 TSecr=703394224",yes
259,260,0.056139337000000004,127.0.0.1,127.0.0.1,TCP,450,"5001  >  38492 [PSH, ACK] Seq=49537 Ack=21191 Win=3083 Len=384 TSval=703394224 TSecr=703394224",yes
260,261,0.079796014,127.0.0.1,127.0.0.1,TCP,229,"38492  >  5001 [PSH, ACK] Seq=21191 Ack=49921 Win=6146 Len=163 TSval=703394248 TSecr=703394224",yes
261,262,0.07986997700000001,127.0.0.1,127.0.0.1,TCP,450,"5001  >  38492 [PSH, ACK] Seq=49921 Ack=21354 Win=3083 Len=384 TSval=703394248 TSecr=703394248",yes
262,263,0.079910382,127.0.0.1,127.0.0.1,TCP,229,"38492  >  5001 [PSH, ACK] Seq=21354 Ack=50305 Win=6146 Len=163 TSval=703394248 TSecr=703394248",yes
263,264,0.079938179,127.0.0.1,127.0.0.1,TCP,450,"5001  >  38492 [PSH, ACK] Seq=50305 Ack=21517 Win=3083 Len=384 TSval=703394248 TSecr=703394248",yes
264,265,0.079965686,127.0.0.1,127.0.0.1,TCP,229,"38492  >  5001 [PSH, ACK] Seq=21517 Ack=50689 Win=6146 Len=163 TSval=703394248 TSecr=703394248",yes
265,266,0.079989692,127.0.0.1,127.0.0.1,TCP,450,"5001  >  38492 [PSH, ACK] Seq=50689 Ack=21680 Win=3083 Len=384 TSval=703394248 TSecr=703394248",yes
266,267,0.08001188299999999,127.0.0.1,127.0.0.1,TCP,229,"38492  >  5001 [PSH, ACK] Seq=21680 Ack=51073 Win=6146 Len=163 TSval=703394248 TSecr=703394248",yes
